recipient_parent_name1,current_total_value_of_award,potential_total_value_of_award,number_of_offers_received,number_of_employees,annual_revenue,awards_counts,recipient_name,recipient_parent_name,organizational_type,contracting_officers_determination_of_business_size,organizational_type,year
PRINCEOFWALESTRIBALENTERPRISECONSORTIUMLLC,0.0,0.0,1.0,30.0,1500000.0,1,PRINCE OF WALES TRIBAL ENTERPRISE CONSORTIUM LIMITED LIABILITY COMPANY,PRINCE OF WALES TRIBAL ENTERPRISE CONSORTIUM LLC,,SMALL BUSINESS,,2009
PROBUYSOLUTIONSLLC,0.0,0.0,3.0,2.0,80000.0,1,"PRO BUY SOLUTIONS, LLC","PRO BUY SOLUTIONS, LLC",,SMALL BUSINESS,,2009
PROCURENETINCORPORATED,7128.0,7128.0,2.0,0.0,0.0,1,PROCURENET INC,PROCURENET INCORPORATED,,OTHER THAN SMALL BUSINESS,,2009
PROCUREVISINC,157976.04,157976.04,1009.0,25.0,1202000.0,3,PROCUREVIS INCORPORATED,"PROCUREVIS, INC.",,SMALL BUSINESS,,2009
PROFESSIONALALARMSYSTEMSINC,0.0,0.0,3.0,21.666666666666668,1445194.3333333333,3,PROFESSIONAL ALARM SYSTEMS INC,PROFESSIONAL ALARM SYSTEMS INC,,SMALL BUSINESS,,2009
PROFESSIONALALTERATIONSEMBROIDERYINC,5985.0,5985.0,0.0,12.0,3.0,1,PROFESSIONAL ALTERATIONS & EMBROIDERY INC,PROFESSIONAL ALTERATIONS & EMBROIDERY INC,,SMALL BUSINESS,,2009
PROFESSIONALANALYSISINC,0.0,0.0,63.0,0.0,0.0,3,PROFESSIONAL ANALYSIS INC,PROFESSIONAL ANALYSIS INC,,OTHER THAN SMALL BUSINESS,,2009
PROFESSIONALANDSCIENTIFICASSOCIATESINC,3062362.4000000004,7556899.64,12.0,76.21875,11624248.21875,32,PROFESSIONAL AND SCIENTIFIC ASSOCIATES INCORPORATED,PROFESSIONAL AND SCIENTIFIC ASSOCIATES  INC.,,SMALL BUSINESS,,2009
PROFESSIONALCOMMUNICATIONSINC,0.0,0.0,1.0,33.0,31.0,1,"PROFESSIONAL COMMUNICATIONS,INC.","PROFESSIONAL COMMUNICATIONS,INC.",,SMALL BUSINESS,,2009
PROFESSIONALCONTRACTSERVICESINC,6430397.77,6430397.77,1.0,800.0,30000000.0,1,PROFESSIONAL CONTRACT SERVICES INC,PROFESSIONAL CONTRACT SERVICES  INC.,CORPORATE TAX EXEMPT,OTHER THAN SMALL BUSINESS,CORPORATE TAX EXEMPT,2009
PROFESSIONALPERFORMANCEDEVELOPMENTGROUPINC,1068847.84,1068847.84,190.0,371.625,13206250.0,16,PROFESSIONAL PERFORMANCE DEVELOPMENT GROUP INCORPORATED,PROFESSIONAL PERFORMANCE DEVELOPMENT GROUP  INC.,,SMALL BUSINESS,,2009
PROFESSIONALSOFTWAREENGINEERINGINC,170467.06,170467.06,12.0,0.0,0.0,1,PROFESSIONAL SOFTWARE ENGINEER,PROFESSIONAL SOFTWARE ENGINEERING  INC.,,OTHER THAN SMALL BUSINESS,,2009
PROFESSIONALSOLUTIONS1LLC,182046.09,0.0,1.0,80.0,5000000.0,2,PROFESSIONAL SOLUTIONS LLC,"PROFESSIONAL SOLUTIONS1, LLC",,SMALL BUSINESS,,2009
PROFESSIONALSYSTEMSASSOCIATESINC,0.0,0.0,1.0,19.0,2400000.0,1,PROFESSIONAL SYSTEMS ASSOCIATES INCORPORATED,"PROFESSIONAL SYSTEMS ASSOCIATES, INC",,SMALL BUSINESS,,2009
PROGENYSYSTEMSCORPORATION,98551.01,98551.01,3.0,289.5,51511813.5,2,PROGENY SYSTEMS CORPORATION,PROGENY SYSTEMS CORPORATION,OTHER,SMALL BUSINESS,OTHER,2009
PROGRESSENERGYINC,25460.35,25460.35,1.0,9000.0,9600000000.0,1,CAROLINA POWER & LIGHT COMPANY,PROGRESS ENERGY  INC.,CORPORATE NOT TAX EXEMPT,OTHER THAN SMALL BUSINESS,CORPORATE NOT TAX EXEMPT,2009
PROGRESSIVEFINANCIALSERVICESINC,0.0,0.0,80.0,0.0,0.0,2,PFS/PROGRESSIVE FINANCIAL SERV,"PROGRESSIVE FINANCIAL SERVICES, INC.",,SMALL BUSINESS,,2009
PROIMAGECORPORATION,0.0,0.0,3.0,3.0,300000.0,2,PRO IMAGE CORPORATION,PRO IMAGE CORPORATION,,SMALL BUSINESS,,2009
PROJECTENHANCEMENTCORPORATION,17670927.37,17670927.37,1.0,35.0,5860070.0,1,PROJECT ENHANCEMENT CORPORATION,PROJECT ENHANCEMENT CORPORATION,,SMALL BUSINESS,,2009
PROLOGUE,0.0,0.0,1.0,50.0,9000000.0,1,"IMECOM GROUP, INC",PROLOGUE,,OTHER THAN SMALL BUSINESS,,2009
PROMETHEUSLABORATORIESINC,76537.37,76537.37,1.0,210.0,1.0,1,PROMETHEUS LABORATORIES INCORPORATED,PROMETHEUS LABORATORIES INC.,,SMALL BUSINESS,,2009
PROPULSIONCONTROLSENGINEERING,31035.0,31035.0,1.0,120.0,27000000.0,1,PROPULSION CONTROLS ENGINEERING,PROPULSION CONTROLS ENGINEERING,,SMALL BUSINESS,,2009
PROSOLIAINC,0.0,0.0,1.0,5.0,1000000.0,1,PROSOLIA INCORPORATED,"PROSOLIA, INC.",,SMALL BUSINESS,,2009
PROSOURCEPACKAGINGINC,3823.0,3823.0,3.0,4.0,1356000.0,1,"PROSOURCE PACKAGING, INC.",PROSOURCE PACKAGING  INC.,,SMALL BUSINESS,,2009
PROTECTIONSTRATEGIESINCORPORATED,12083238.81,13492891.77,58.0,115.07692307692308,13891045.0,13,PROTECTION STRATEGIES INCORPORATED,PROTECTION STRATEGIES INCORPORATED,,SMALL BUSINESS,,2009
PROTECTIVESECURITYINC,0.0,0.0,0.0,14.0,1679751.0,1,"PROTECTIVE SECURITY, INC.","PROTECTIVE SECURITY, INC.",,OTHER THAN SMALL BUSINESS,,2009
PROTELECOMLLC,0.0,0.0,2.0,38.0,14000000.0,2,"PROTELECOM, LLC","PROTELECOM, LLC",,SMALL BUSINESS,,2009
PROTELLIGENTLLC,0.0,0.0,1.0,50.0,0.0,1,PROTELLIGENT LLC,"PRO-TELLIGENT, LLC",,OTHER THAN SMALL BUSINESS,,2009
PROTEXCONSULTINGSERVICESLLC,0.0,0.0,2.0,1.0,300000.0,2,PROTEX CONSULTING SERVICES LLC,PROTEX CONSULTING SERVICES LLC,,SMALL BUSINESS,,2009
PROTOTYPEENGINEERINGINC,89520.0,89520.0,10.0,0.0,0.0,2,PROTOTYPE ENGINEERING INC,PROTOTYPE ENGINEERING  INC.,,SMALL BUSINESS,,2009
PROVENGOLLC,0.0,0.0,999.0,6.0,19000000.0,1,"PROVENGO, LLC","PROVENGO, LLC",,SMALL BUSINESS,,2009
PRUDENTIALFINANCIALINC,1514066.7800000003,483385.63999999996,0.0,843.0,54.0,49,PRUDENTIAL RESIDENTIAL SERVICES LIMITED PARTNERSHIP (3622),PRUDENTIAL FINANCIAL INC.,,OTHER THAN SMALL BUSINESS,,2009
PRUDENTIALOVERALLSUPPLY,52719.62,52719.62,2.0,1632.0,120000000.0,1,PRUDENTIAL OVERALL SUPPLY,PRUDENTIAL OVERALL SUPPLY,,OTHER THAN SMALL BUSINESS,,2009
PRUTHIALBAN,21280.0,21280.0,2.0,1.0,1.0,3,"PRUTHI, ALBAN",PRUTHI  ALBAN,SOLE PROPRIETORSHIP,OTHER THAN SMALL BUSINESS,SOLE PROPRIETORSHIP,2009
PSCLLC,7731.25,7731.25,3.0,150.0,35000000.0,1,PHILIP ENVIROMENTAL INCORPORATED (6173),PSC  LLC,,OTHER THAN SMALL BUSINESS,,2009
PSISIERRALLC,0.0,0.0,13.0,1.0,1.0,1,PSI SIERRA LIMITED LIABILITY COMPANY,"PSI SIERRA, LLC",,SMALL BUSINESS,,2009
PUBLICPROPERTIESLLC,43115.0,43115.0,2.0,5.0,1000000.0,2,PUBLIC PROPERTIES LLC,PUBLIC PROPERTIES LLC,,SMALL BUSINESS,,2009
PUBLICSERVICEENTERPRISEGROUPINCORPORATED,103213.2,103213.2,1.0,10000.0,6600000000.0,1,PUBLIC SERVICE ENTERPRISE GROUP INCORPORATED,PUBLIC SERVICE ENTERPRISE GROUP INCORPORATED,CORPORATE NOT TAX EXEMPT,OTHER THAN SMALL BUSINESS,CORPORATE NOT TAX EXEMPT,2009
PUBLICUTILITYDISTRICT1OFKITTITASCOUNTY,0.0,0.0,3.0,0.0,0.0,3,PUBLIC UTILITY DISTRICT #1 IF,PUBLIC UTILITY DISTRICT 1 OF KITTITAS COUNTY,,OTHER THAN SMALL BUSINESS,,2009
PUBLICWHOLESALEWATERSUPPLYDISTRICT12,0.0,0.0,1.0,4.0,500000.0,1,PUBLIC WHOLESALE WATER SUPPLY DISTRICT 12,PUBLIC WHOLESALE WATER SUPPLY DISTRICT 12,,OTHER THAN SMALL BUSINESS,,2009
PUERTORICOELECTRICPOWERAUTHORITY,0.0,0.0,4.0,9629.0,3131522670.0,4,PUERTO RICO ELECTRIC POWER AUTHORITY,PUERTO RICO ELECTRIC POWER AUTHORITY,,OTHER THAN SMALL BUSINESS,,2009
PUERTORICOPSYCHOLOGICALASSOCIATES,0.0,0.0,5.0,1.0,1.0,1,PUERTO RICO PSYCHOLOGICAL ASSOCIATES,PUERTO RICO PSYCHOLOGICAL ASSOCIATES,,SMALL BUSINESS,,2009
PUERTORICOSALESMEDICALSERVICEINC,0.0,0.0,1.0,9.0,3000000.0,1,PUERTO RICO SALES & MEDICAL SERVICE INC.,PUERTO RICO SALES & MEDICAL SERVICE INC,,SMALL BUSINESS,,2009
PUERTORICOTELEPHONECOMPANYINC,0.0,0.0,1.0,4700.0,1305000000.0,1,PUERTO RICO TELEPHONE CO,"PUERTO RICO TELEPHONE COMPANY, INC.",,OTHER THAN SMALL BUSINESS,,2009
PUGETSOUNDENERGYINC,0.0,0.0,3.0,0.0,0.0,3,PUGET SOUND ENERGY (INC),PUGET SOUND ENERGY (INC),,OTHER THAN SMALL BUSINESS,,2009
PUGLIAENGINEERINGINC,1471845.9,1471845.9,6.0,120.0,20000000.0,2,PUGLIA ENGINEERING INCORPORATED,PUGLIA ENGINEERING  INC.,,SMALL BUSINESS,,2009
PUJIWASONOPRIYO,0.0,0.0,0.0,1.0,1.0,1,"PUJIWASONO, PRIYO",PUJIWASONO  PRIYO,SOLE PROPRIETORSHIP,OTHER THAN SMALL BUSINESS,SOLE PROPRIETORSHIP,2009
PUMPBIZINC,4844.0,4844.0,3.0,7.0,1200000.0,1,"PUMPBIZ, INC.","PUMPBIZ, INC.",,SMALL BUSINESS,,2009
PURCELLCONSTRUCTIONCORP,119889757.0,119889757.0,3.0,85.0,40000000.0,1,PURCELL CONSTRUCTION CORPORATION,PURCELL CONSTRUCTION CORP.,,OTHER THAN SMALL BUSINESS,,2009
PURDUEPRODUCTSLP,0.0,251900.0,2.0,1386.0,1329906304.0,1,PURDUE PRODUCTS LP,PURDUE PRODUCTS LP,PARTNERSHIP,OTHER THAN SMALL BUSINESS,PARTNERSHIP,2009
PURVISSYSTEMSINCORPORATED,2500364.62,2500364.62,16.0,0.0,0.0,7,PURVIS SYSTEMS INCORPORATED,PURVIS SYSTEMS INCORPORATED,,SMALL BUSINESS,,2009
QEDGROUPLLCTHE,1617296.42,1617296.42,4.0,18.0,1000000.0,2,THE QED GROUP LLC,QED GROUP  LLC  THE,,OTHER THAN SMALL BUSINESS,,2009
QEDSYSTEMSINC,0.0,0.0,14.0,0.0,0.0,5,Q E D SYSTEMS INC,"QED SYSTEMS, INC.",,OTHER THAN SMALL BUSINESS,,2009
QIAGENNV,0.0,0.0,0.0,400.0,99000000.0,10,QIAGEN INCORPORATED,QIAGEN N.V.,,OTHER THAN SMALL BUSINESS,,2009
QINETIQGROUPPLC,6397446.2,6397446.2,33.0,4935.809523809524,1149835169.5238094,21,PLANNING SYSTEMS INCORPORATED,QINETIQ GROUP PLC,,OTHER THAN SMALL BUSINESS,,2009
QSRINTERNATIONALAMERICASINC,0.0,0.0,0.0,50.0,24000000.0,1,"QSR INTERNATIONAL (AMERICAS), INC.","QSR INTERNATIONAL (AMERICAS), INC.",,SMALL BUSINESS,,2009
QTCMANAGEMENTINC,0.0,0.0,2.0,350.0,70000000.0,1,QTC MANAGEMENT INCORPORATED,"QTC MANAGEMENT, INC.",,OTHER THAN SMALL BUSINESS,,2009
QUADRUSCORPORATION,0.0,4000000.0,1.0,10.0,1750000.0,1,QUADRUS CORPORATION,QUADRUS CORPORATION,CORPORATE NOT TAX EXEMPT,SMALL BUSINESS,CORPORATE NOT TAX EXEMPT,2009
QUALITYAIRCRAFTPARTSINC,16900.0,16900.0,7.0,21.0,4000000.0,1,QUALITY AIRCRAFT PARTS INC,QUALITY AIRCRAFT PARTS  INC.,,SMALL BUSINESS,,2009
QUALITYBIOLOGICALINC,64366.600000000006,0.0,2.0,25.0,4750000.0,6,"QUALITY BIOLOGICAL, INC.",QUALITY BIOLOGICAL  INC.,CORPORATE NOT TAX EXEMPT,SMALL BUSINESS,CORPORATE NOT TAX EXEMPT,2009
QUALITYCOOLINGCORPORATION,0.0,0.0,1.0,4.0,140000.0,1,QUALITY COOLING CORPORATION,QUALITY COOLING CORPORATION,,SMALL BUSINESS,,2009
QUALITYELECTRICSE,0.0,0.0,1.0,80.0,3000000.0,1,"QUALITY ELECTRIC, S.E.","QUALITY ELECTRIC, S.E.",,SMALL BUSINESS,,2009
QUALITYREFRIGERATIONCOMPANYINC,3413.0,3413.0,3.0,6.0,1800000.0,1,"QUALITY REFRIGERATION COMPANY, INC.",QUALITY REFRIGERATION COMPANY  INC.,,OTHER THAN SMALL BUSINESS,,2009
QUALITYSOFTWARESERVICESINC,0.0,0.0,42.0,101.0,3000004.8,5,"Q.S.S., INC.","QUALITY SOFTWARE SERVICES, INC.",,SMALL BUSINESS,,2009
QUALITYTOOLINGLLC,11138.22,11138.22,3.0,20.0,3332000.0,1,"QUALITY TOOLING, LLC",QUALITY TOOLING  LLC,,SMALL BUSINESS,,2009
QUANTACHROMECORPORATION,0.0,0.0,1.0,95.0,12000000.0,2,QUANTACHROME CORPORATION,QUANTACHROME CORPORATION,,SMALL BUSINESS,,2009
QUANTECHSERVICESINC,0.0,0.0,1.0,112.0,14.0,1,QUANTECH SERVICES INCORPORATED,QUANTECH SERVICES INC.,,SMALL BUSINESS,,2009
QUANTELLINC,0.0,0.0,50.0,243.0,11318000.0,2,QUANTELL INCORPORATED,"QUANTELL, INC.",,SMALL BUSINESS,,2009
QUANTUM3DINC,5000.0,5000.0,1.0,110.0,23000000.0,1,"QUANTUM3D, INC.",QUANTUM3D  INC.,CORPORATE NOT TAX EXEMPT,SMALL BUSINESS,CORPORATE NOT TAX EXEMPT,2009
QUANTUMDESIGNINC,0.0,0.0,1.0,110.0,155000.0,1,QUANTUM DESIGN INCORPORATED,"QUANTUM DESIGN, INC.",,SMALL BUSINESS,,2009
QUANTUMRESEARCHINTERNATIONALINC,74783462.49,75299653.89,5.0,224.75,23967825.0,4,QUANTUM RESEARCH INTERNATIONAL INCORPORATED,"QUANTUM RESEARCH INTERNATIONAL, INC.",,SMALL BUSINESS,,2009
QUARTZMOUNTAINRESORT,0.0,0.0,3.0,85.0,2950000.0,1,QUARTZ MOUNTAIN RESORT,QUARTZ MOUNTAIN RESORT,,OTHER THAN SMALL BUSINESS,,2009
QUASARFEDERALSYSTEMSINC,757866.0,1160122.0,21.0,20.0,1000000.0,1,QUASAR FEDERAL SYSTEMS INCORPORATED,QUASAR FEDERAL SYSTEMS  INC.,,SMALL BUSINESS,,2009
QUESTANALYTICSLLC,0.0,0.0,1.0,5.0,400000.0,1,QUEST ANALYTICS LIMITED LIABILITY COMPANY,QUEST ANALYTICS LLC,,SMALL BUSINESS,,2009
QUESTDIAGNOSTICSINCORPORATED,397487.28,397487.28,82.0,10734.939759036144,9759036.144578313,83,QUEST DIAGNOSTICS INCORPORATED (4239),QUEST DIAGNOSTICS INCORPORATED,,OTHER THAN SMALL BUSINESS,,2009
QUESTIONMARKCORPORATION,51018.0,51018.0,2.0,45.0,6000000.0,2,QUESTIONMARK CORPORATION,QUESTIONMARK CORPORATION,,SMALL BUSINESS,,2009
QUESTSOFTWAREINC,220290.0,220290.0,1.0,88.0,9731484.0,1,"NETPRO COMPUTING, INC.",QUEST SOFTWARE  INC.,,SMALL BUSINESS,,2009
QUICKCRETEPRODUCTSCORP,0.0,0.0,999.0,120.0,9000000.0,1,QUICK CRETE PRODUCTS CORP.,QUICK CRETE PRODUCTS CORP.,,SMALL BUSINESS,,2009
QUICKMESSENGERSERVICE,0.0,0.0,0.0,1.0,100.0,1,QUICK MESSENGER SERVICE,QUICK MESSENGER SERVICE,,SMALL BUSINESS,,2009
QUICKMESSENGERSERVICEOFDCINC,0.0,0.0,0.0,11.0,4000000.0,1,QUICK MESSENGER SERVICE OF DC INC,QUICK MESSENGER SERVICE OF DC INC,CORPORATE NOT TAX EXEMPT,OTHER THAN SMALL BUSINESS,CORPORATE NOT TAX EXEMPT,2009
QWESTCOMMUNICATIONSINTERNATIONALINC,1884850.08,1884850.08,2.0,30000.0,13000000000.0,1,QWEST CORPORATION,QWEST COMMUNICATIONS INTERNATIONAL INC.,CORPORATE NOT TAX EXEMPT,OTHER THAN SMALL BUSINESS,CORPORATE NOT TAX EXEMPT,2009
QWESTGOVERNMENTSERVICESINC,0.0,0.0,35.0,30000.0,12999999488.0,29,QWEST GOVERNMENT SERVICES INC,"QWEST GOVERNMENT SERVICES, INC.",,OTHER THAN SMALL BUSINESS,,2009
RADAMESPENAINC,0.0,0.0,1.0,36.0,5272209.0,1,"RADAMES PENA, INC.","RADAMES PENA, INC.",,SMALL BUSINESS,,2009
RADIANCETECHNOLOGIESINC,496985.0,496985.0,27.0,271.05555555555554,43255291.11111111,18,RADIANCE TECHNOLOGIES INC,"RADIANCE TECHNOLOGIES, INC.",,SMALL BUSINESS,,2009
RADIOLOGICALSOLUTIONSINC,0.0,0.0,1.0,3.0,1200000.0,1,RADIOLOGICAL SOLUTIONS INCORPORATED,RADIOLOGICAL SOLUTIONS INC,,OTHER THAN SMALL BUSINESS,,2009
RADIOSERVICESINC,0.0,0.0,1.0,0.0,0.0,1,RADIO SERVICES INC,RADIO SERVICES INC.,,OTHER THAN SMALL BUSINESS,,2009
RADIXBIOSOLUTIONSLTD,0.0,0.0,88.0,5.0,2022620.0,2,RADIX BIO SOLUTIONS LIMITED,"RADIX BIO SOLUTIONS, LTD.",,SMALL BUSINESS,,2009
RADIXIIINC,0.0,0.0,999.0,9.0,1.0,1,RADIX II INCORPORATED,RADIX II INC,,SMALL BUSINESS,,2009
RAFAELNUNEZCUESTA,0.0,0.0,3.0,1.0,28000.0,1,RAFAEL NUNEZ-CUESTA,RAFAEL NUNEZ-CUESTA,SOLE PROPRIETORSHIP,OTHER THAN SMALL BUSINESS,SOLE PROPRIETORSHIP,2009
RAHIMHEROW,57825.0,57825.0,1.0,1.0,35000.0,1,"RAHIM, HEROW",RAHIM  HEROW,SOLE PROPRIETORSHIP,OTHER THAN SMALL BUSINESS,SOLE PROPRIETORSHIP,2009
RAHIMIMAHMONIR,9850.0,2850.0,1.0,1.0,100000.0,6,"RAHIMI, MAHMONIR",RAHIMI  MAHMONIR,SOLE PROPRIETORSHIP,SMALL BUSINESS,SOLE PROPRIETORSHIP,2009
RAHMANISAEED,0.0,0.0,0.0,1.0,70000.0,1,RAHMANI SAEED,RAHMANI SAEED,SOLE PROPRIETORSHIP,SMALL BUSINESS,SOLE PROPRIETORSHIP,2009
RAILAMERICAINC,0.0,0.0,1.0,0.0,0.0,1,PUGET SOUND & PACIFIC RAILROAD,RAILAMERICA  INC.,,SMALL BUSINESS,,2009
RAINANDHAILINSURANCESERVICEINC,0.0,0.0,0.0,388.0,343310333.0,1,RAIN & HAIL LLC,RAIN AND HAIL INSURANCE SERVICE  INC.,,SMALL BUSINESS,,2009
RAKHLINSERGE,0.0,0.0,0.0,0.0,29100.0,3,RAKHLIN SERGE,RAKHLIN SERGE,SOLE PROPRIETORSHIP,OTHER THAN SMALL BUSINESS,SOLE PROPRIETORSHIP,2009
RALBOINC,69125.0,69125.0,2.0,6.0,350000.0,1,RALBO INCORPORATED,RALBO  INC.,,SMALL BUSINESS,,2009
RAMPARTMARKETINGINCORPORATED,9422.2,9422.2,2.0,2.0,400000.0,1,RAMPART MARKETING INCORPORATED,RAMPART MARKETING INCORPORATED,,SMALL BUSINESS,,2009
RAMSEYJOHNR,0.0,0.0,1.0,1.0,31500.0,2,"RAMSEY, JOHN R","RAMSEY, JOHN R",,SMALL BUSINESS,,2009
RAMTECHSUPPORTSERVICESINC,0.0,0.0,999.0,500.0,19321526.0,1,RAM TECH INC,"RAMTECH SUPPORT SERVICES, INC.",,SMALL BUSINESS,,2009
RANCOCONSTRUCTIONINC,1436890.68,1436890.68,1.0,18.0,5000000.0,1,RANCO CONSTRUCTION INCORPORATED,RANCO CONSTRUCTION INC,,SMALL BUSINESS,,2009
RANDCORPORATIONTHE,0.0,0.0,48.0,1228.5714285714287,739897142.8571428,7,RAND CORPORATION,"RAND CORPORATION, THE",,OTHER THAN SMALL BUSINESS,,2009
RANDYDUSENBERRY,8592.0,21480.0,8.0,1.0,10000.0,1,RANDY DUSENBERRY,RANDY DUSENBERRY,,SMALL BUSINESS,,2009
RANDYSCALLAHANCONSTRUCTIONCOMPANYINC,4612958.0,4612958.0,2.0,8.0,1200000.0,2,"CALLAHAN, RANDY S CONSTRUCTION COMPANY INC",RANDY S. CALLAHAN CONSTRUCTION COMPANY  INC.,CORPORATE NOT TAX EXEMPT,SMALL BUSINESS,CORPORATE NOT TAX EXEMPT,2009
RANGERAMERICANOFPUERTORICOINC,0.0,0.0,4.0,150.0,11666666.666666666,3,RANGER AMERICAN OF PUERTO RICO INC.,RANGER AMERICAN OF PUERTO RICO INC.,,OTHER THAN SMALL BUSINESS,,2009
RANGERINTERNATIONALSERVICESGROUPINC,1211043.65,1211043.65,8.0,0.0,0.0,1,"U S LOGISTICS, INC",RANGER INTERNATIONAL SERVICES GROUP  INC.,,SMALL BUSINESS,,2009
RAORADIOLOGISTSINC,10331430.43,10331430.43,204.0,129.72727272727272,8090909.090909091,11,"RAO RADIOLOGISTS, INC.",RAO RADIOLOGISTS  INC.,,SMALL BUSINESS,,2009
RAPPAHANNOCKGOODWILLINDUSTRIESINC,736.43,736.43,3.0,320.0,12000000.0,1,RAPPAHANNOCK GOODWILL INDUSTRIES INCORPORATED,RAPPAHANNOCK GOODWILL INDUSTRIES  INC.,,SMALL BUSINESS,,2009
RASHIDSHAYAN,0.0,0.0,0.0,1.0,45000.0,1,"RASHID, SHAYAN","RASHID, SHAYAN",SOLE PROPRIETORSHIP,OTHER THAN SMALL BUSINESS,SOLE PROPRIETORSHIP,2009
RAVENINDUSTRIESINC,0.0,0.0,1005.0,0.0,0.0,7,"AEROSTAR INTERNATIONAL, INC","RAVEN INDUSTRIES, INC.",,OTHER THAN SMALL BUSINESS,,2009
RAYDIANCEINC,749858.0,749858.0,2.0,42.0,2000000.0,1,"RAYDIANCE, INC.",RAYDIANCE  INC.,CORPORATE NOT TAX EXEMPT,SMALL BUSINESS,CORPORATE NOT TAX EXEMPT,2009
RAYMONDEXPRESSCORPORATION,2140898.88,2140898.88,7.0,65.0,21000000.0,1,RAYMOND EXPRESS CORPORATION,RAYMOND EXPRESS CORPORATION,CORPORATE NOT TAX EXEMPT,SMALL BUSINESS,CORPORATE NOT TAX EXEMPT,2009
RAYSADDLER,15965.0,15965.0,1.0,1.0,35000.0,1,RAY SADDLER,RAY SADDLER,,SMALL BUSINESS,,2009
RAYTHEONCOMPANY,1067190209.8600001,1117577515.8600001,464.0,37946.02127659575,5467781890.111702,188,RAYTHEON TECHNICAL SERVICES COMPANY LIMITED LIABILITY COMPANY (5772),RAYTHEON COMPANY,,OTHER THAN SMALL BUSINESS,,2009
RBCBEARINGSINCORPORATED,0.0,0.0,8.0,1633.3333333333333,225000000.0,6,RBC TRANSPORT DYNAMICS CORP.,RBC BEARINGS INCORPORATED,,OTHER THAN SMALL BUSINESS,,2009
RBCINCORPORATED,0.0,0.0,2.0,0.0,0.0,2,R B C INCORPORATED,RBC  INCORPORATED,,SMALL BUSINESS,,2009
RBFCONSULTINGFOUNDATION,194227.24,194227.24,14.0,1025.0,150000000.0,1,RBF CONSULTING,RBF CONSULTING FOUNDATION,CORPORATE NOT TAX EXEMPT,OTHER THAN SMALL BUSINESS,CORPORATE NOT TAX EXEMPT,2009
RCHRISTOPHERGOODWINASSOCIATESINC,0.0,0.0,3.0,150.0,9074000.0,1,R CHRISTOPHER GOODWIN & ASSOCIATES INC,"R. CHRISTOPHER GOODWIN & ASSOCIATES, INC.",,SMALL BUSINESS,,2009
RCIINC,0.0,0.0,3.0,110.0,5000000.0,1,RCI INCORPORATED (5832),RCI INC.,,SMALL BUSINESS,,2009
RCRANESCALESALESUSALLC,0.0,0.0,999.0,1.0,1400000.0,1,"R CRANE SCALE SALES - USA, LLC","R CRANE SCALE SALES - USA, LLC",,SMALL BUSINESS,,2009
RDFCORPORATION,0.0,99999.99,1.0,90.0,6500000.0,1,RDF CORPORATION,RDF CORPORATION,CORPORATE NOT TAX EXEMPT,OTHER THAN SMALL BUSINESS,CORPORATE NOT TAX EXEMPT,2009
READINESSGROUPINTERNATIONALLLC,0.0,0.0,0.0,2.0,25.0,2,READINESS GROUP INTERNATIONAL,READINESS GROUP INTERNATIONAL LLC,,SMALL BUSINESS,,2009
REALIZATIONTECHNOLOGIESINC,3183500.0,3183500.0,4.0,0.0,0.0,4,"REALIZATION TECHNOLOGIES, INC",REALIZATION TECHNOLOGIES  INC.,,SMALL BUSINESS,,2009
REALTYASSOCIATESFUNDVILP,2258342.34,2258342.34,6.0,5.0,1840260.0,2,REALTY ASSOCIATES FUND VI LIMITED PARTNERSHIP,REALTY ASSOCIATES FUND VI  LP,,OTHER THAN SMALL BUSINESS,,2009
RECOLOGYINC,36917.28,36917.28,2.0,45.0,9811110.0,1,A G G ENTERPRISES INCORPORATED,RECOLOGY INC.,,SMALL BUSINESS,,2009
RECOVERYPOINTSYSTEMSINC,0.0,0.0,2.0,40.0,500000.0,1,RECOVERY POINT SYSTEMS INCORPORATED,"RECOVERY POINT SYSTEMS, INC.",,SMALL BUSINESS,,2009
RECTORVISITORSOFTHEUNIVERSITYOFVIRGINIA,0.0,0.0,1.0,12000.0,140000000.0,1,RECTOR & VISITORS OF THE UNIVERSITY OF VIRGINIA,RECTOR & VISITORS OF THE UNIVERSITY OF VIRGINIA,,OTHER THAN SMALL BUSINESS,,2009
REDDROOFINGANDCONSTRUCTIONCOMPANY,158651.7,158651.7,3.0,0.0,10000000.0,1,REDD ROOFING AND CONSTRUCTION,REDD ROOFING AND CONSTRUCTION COMPANY,,SMALL BUSINESS,,2009
REDHILLVENTURESLLC,0.0,0.0,2010.0,1.0,200000.0,5,RED HILL VENTURES LLC,RED HILL VENTURES LLC,,SMALL BUSINESS,,2009
REDINC,0.0,0.0,999.0,150.0,4000000.0,1,RED INCORPORATED,"RED, INC.",,SMALL BUSINESS,,2009
REDLANDTECHCENTERLLC,0.0,0.0,2.0,1.0,1.0,2,"REDLAND TECH CENTER, LLC","REDLAND TECH CENTER, LLC",,SMALL BUSINESS,,2009
REDRIVERCOMMUNICATIONSINC,4582719.45,4582719.45,9.0,253.0,23.0,1,RED RIVER COMMUNICATIONS INCORPORATED (9105),RED RIVER COMMUNICATIONS INC,,SMALL BUSINESS,,2009
REDRIVERCOMPUTERCOINC,0.0,0.0,1.0,60.0,94000000.0,1,"RED RIVER COMPUTER CO., INC.","RED RIVER COMPUTER CO., INC.",,SMALL BUSINESS,,2009
REEDASSOCIATESCPASINC,0.0,0.0,15.0,10.0,3000000.0,3,REED AND ASSOCIATES CPAS,"REED & ASSOCIATES, CPAS, INC.",,SMALL BUSINESS,,2009
REEDELSEVIERGROUPPLC,5899.27,5899.27,4.0,488.8,127834872.0,5,R S MEANS COMPANY INC,REED ELSEVIER GROUP PLC,,OTHER THAN SMALL BUSINESS,,2009
REEMACONSULTINGSERVICESINC,0.0,0.0,9.0,0.0,0.0,1,REEMA CONSULTING SERVICES INC,REEMA CONSULTING SERVICES  INC.,,SMALL BUSINESS,,2009
REFRIGERANTRECYCLINGINC,74600.0,74600.0,2.0,20.0,2046520.0,2,REFRIGERANT RECYCLING INCORPORATED,REFRIGERANT RECYCLING INC.,,SMALL BUSINESS,,2009
REGENTSOFTHEUNIVERSITYOFCALIFORNIA,0.0,0.0,1.0,5000.0,500000000.0,1,USDCA SCHOOL OF MEDICINE92093,REGENTS OF THE UNIVERSITY OF CALIFORNIA,,OTHER THAN SMALL BUSINESS,,2009
REGENTSOFTHEUNIVERSITYOFCOLORADOTHE,0.0,0.0,4.0,3333.0,250001666.5,2,"REGENTS OF THE UNIVERSITY OF COLORADO, THE","REGENTS OF THE UNIVERSITY OF COLORADO, THE",,OTHER THAN SMALL BUSINESS,,2009
REGENTSOFTHEUNIVERSITYOFMINNESOTA,0.0,0.0,3.0,22333.333333333332,1000000000.0,3,REGENTS OF THE UNIVERSITY OF MINNESOTA,REGENTS OF THE UNIVERSITY OF MINNESOTA,,OTHER THAN SMALL BUSINESS,,2009
REGENTSTENNESSEEBOARDOF,0.0,0.0,3.0,2000.0,7800000.0,3,EAST TENNESSEE STATE UNIVERSITY,"REGENTS, TENNESSEE BOARD OF",,OTHER THAN SMALL BUSINESS,,2009
REGISASSOCIATESPC,0.0,0.0,11.0,50.0,5000000.0,6,REGIS AND ASSOCIATES PC,REGIS & ASSOCIATES PC,,SMALL BUSINESS,,2009
REGISPROPERTIESLLC,39946.85,0.0,0.0,127.0,22000000.0,2,"REGIS PROPERTIES, LLC",REGIS PROPERTIES  L.L.C.,CORPORATE NOT TAX EXEMPT,OTHER THAN SMALL BUSINESS,CORPORATE NOT TAX EXEMPT,2009
REIDMIDDLETONINC,2558649.0,2558649.0,14.0,0.0,0.0,1,REID MIDDLETON INC,REID MIDDLETON  INC.,,OTHER THAN SMALL BUSINESS,,2009
REIMPAMELA,0.0,0.0,0.0,2.0,20000.0,1,PAMELA REIM,"REIM, PAMELA",,SMALL BUSINESS,,2009
REINENMACHINESALESINC,586000.0,586000.0,7.0,3.0,676700.0,2,REINEN MACHINE SALES INC,REINEN MACHINE SALES INC,CORPORATE NOT TAX EXEMPT,SMALL BUSINESS,CORPORATE NOT TAX EXEMPT,2009
RELIABLEPARTSLTD,304.19,304.19,2.0,140.0,30000000.0,1,RELIABLE PARTS INCORPORATED,RELIABLE PARTS LTD,,SMALL BUSINESS,,2009
REMPRODUCTSINC,95368.0,95368.0,2.0,18.0,2100000.0,1,REM PRODUCTS INCORPORATED,REM PRODUCTS INC.,,SMALL BUSINESS,,2009
RENSSELAERPOLYTECHNICINSTITUTE,0.0,0.0,1.0,1500.0,18.0,1,RENSSELAER POLYTECHNIC INSTITUTE,RENSSELAER POLYTECHNIC INSTITUTE,,OTHER THAN SMALL BUSINESS,,2009
RENTOKILINITIALPLC,0.0,0.0,1.0,1200.0,120000000.0,1,"AMBIUS, INC.",RENTOKIL INITIAL PLC,,OTHER THAN SMALL BUSINESS,,2009
REPUBLICSERVICESINC,0.0,0.0,2.0,31000.0,8800000000.0,2,"REPUBLIC SILVER STATE DISPOSAL, INC.","REPUBLIC SERVICES, INC.",,OTHER THAN SMALL BUSINESS,,2009
RESEARCHANALYSISANDENGINEERINGLLC,1523168.0,3067286.0,18.0,0.0,0.0,2,RESEARCH ANALYSIS AND ENGINEER,RESEARCH ANALYSIS AND ENGINEERING  LLC,,SMALL BUSINESS,,2009
RESEARCHANALYSISANDMAINTENANCEINC,26303.26,26303.26,1.0,350.0,32000000.0,1,"RESEARCH ANALYSIS AND MAINTENANCE, INC.",RESEARCH ANALYSIS AND MAINTENANCE  INC.,CORPORATE TAX EXEMPT,OTHER THAN SMALL BUSINESS,CORPORATE TAX EXEMPT,2009
RESEARCHFOUNDATIONFORTHESTATEUNIVERSITYOFNEWYORKTHE,0.0,0.0,1.0,8213.0,75.0,1,THE RESEARCH FOUNDATION OF STATE UNIVERSITY OF NEW YORK,"RESEARCH FOUNDATION FOR THE STATE UNIVERSITY OF NEW YORK, THE",,OTHER THAN SMALL BUSINESS,,2009
RESEARCHPLANNINGINC,26790.3,26790.3,0.0,18.0,2814687.0,1,RESEARCH PLANNING INC,RESEARCH PLANNING  INC.,,SMALL BUSINESS,,2009
RESEARCHTRIANGLEINSTITUTE,0.0,0.0,105.0,2317.5,1353070262.375,16,RESEARCH TRIANGLE INSTITUTE,RESEARCH TRIANGLE INSTITUTE,,OTHER THAN SMALL BUSINESS,,2009
RESEARCHTRIANGLEINSTITUTEINC,18915178.78,19290178.78,19.0,2666.181818181818,1607663042.5454545,11,RESEARCH TRIANGLE INSTITUTE,RESEARCH TRIANGLE INSTITUTE INC,,OTHER THAN SMALL BUSINESS,,2009
RESINTECHINC,302544.0,302544.0,1.0,55.0,13000000.0,1,RESINTECH INCORPORATED,RESINTECH  INC.,,SMALL BUSINESS,,2009
RESODYNCORPORATION,0.0,0.0,8.0,25.0,3844000.0,1,RESODYN CORPORATION,RESODYN CORPORATION,,SMALL BUSINESS,,2009
RESOLUTIONSERVICESLLC,0.0,0.0,0.0,15.0,960000.0,1,RESOLUTION SERVICES LLC,RESOLUTION SERVICES LLC,,SMALL BUSINESS,,2009
RESOURCECONSULTANTSINC,4222415.99,4222415.99,5.0,0.0,0.0,3,"RESOURCE CONSULTANTS, INC",RESOURCE CONSULTANTS INC,,OTHER THAN SMALL BUSINESS,,2009
RESOURCEMANAGEMENTCONCEPTSINC,3207386.18,3207386.18,1.0,95.0,10238081.0,1,RESOURCE MANAGEMENT CONCEPTS INC,RESOURCE MANAGEMENT CONCEPTS INC,CORPORATE NOT TAX EXEMPT,SMALL BUSINESS,CORPORATE NOT TAX EXEMPT,2009
RESPIRATORYANDCONVALESCENTSPECIALTIESINC,0.0,0.0,12.0,18.0,1750000.0,4,"RESPIRATORY AND CONVALESCENT SPECIALTIES, INC.","RESPIRATORY AND CONVALESCENT SPECIALTIES, INC.",,SMALL BUSINESS,,2009
RETROTELINC,62791.0,62791.0,11.0,0.0,0.0,2,"RETROTEL, INC",RETROTEL  INC.,,SMALL BUSINESS,,2009
REVOLUTIONINTERNATIONALLLC,0.0,0.0,1.0,7.0,150000.0,1,REVOLUTION INTERNATIONAL LIMITED LIABILITY COMPANY,REVOLUTION INTERNATIONAL LLC,,SMALL BUSINESS,,2009
REXNORDHOLDINGSINC,0.0,0.0,1.0,5200.0,725000000.0,1,"REXNORD INDUSTRIES, INC.",REXNORD HOLDINGS  INC.,,OTHER THAN SMALL BUSINESS,,2009
REXSYSTEMSINCORPORATED,0.0,0.0,4.0,53.0,8857000.0,1,REX SYSTEMS INCORPORATED,REX SYSTEMS INCORPORATED,,OTHER THAN SMALL BUSINESS,,2009
REYESHUMBERTO,0.0,0.0,2.0,3.0,100000.0,1,REYES HUMBERTO,"REYES, HUMBERTO",,SMALL BUSINESS,,2009
RGAIRCONDITIONINGREFRIGERATIONSERVICECORP,0.0,0.0,3.0,3.0,60000.0,1,R & G AIR CONDITIONING & REFRIGERATION SERVICE CORP,R & G AIR CONDITIONING & REFRIGERATION SERVICE CORP,,SMALL BUSINESS,,2009
RGBSPECTRUM,17170.0,17170.0,3.0,0.0,0.0,1,RGB SPECTRUM,RGB SPECTRUM,,SMALL BUSINESS,,2009
RGSASSOCIATESINC,0.0,0.0,3.0,176.0,27645988.0,1,"RGS ASSOCIATES, INC.","RGS ASSOCIATES, INC.",,OTHER THAN SMALL BUSINESS,,2009
RHEVISIONTECHNOLOGYINC,0.0,0.0,116.0,2.0,150000.0,1,RHEVISION TECHNOLOGY INC,RHEVISION TECHNOLOGY INC,,SMALL BUSINESS,,2009
RHINEHARTRAILROADCONSTRUCTIONINC,59242.75,59242.75,4.0,20.0,1600000.0,1,RHINEHART RAILROAD CONSTRUCTION INCORPORATED,RHINEHART RAILROAD CONSTRUCTION  INC,,SMALL BUSINESS,,2009
RHODEISLANDANDPROVIDENCEPLANTATIONSSTATEOF,0.0,0.0,1.0,500.0,37.0,1,HEALTH RHODE ISLAND DEPARTMENT OF,"RHODE ISLAND AND PROVIDENCE PLANTATIONS, STATE OF",,OTHER THAN SMALL BUSINESS,,2009
RICHARDSONBOTTLINGCOMPANY,0.0,0.0,1.0,95.0,11000000.0,1,RICHARDSON BOTTLING CO INC,RICHARDSON BOTTLING COMPANY,,SMALL BUSINESS,,2009
