recipient_parent_name1,current_total_value_of_award,potential_total_value_of_award,number_of_offers_received,number_of_employees,annual_revenue,awards_counts,recipient_name,recipient_parent_name,organizational_type,contracting_officers_determination_of_business_size,organizational_type,year
KARIMIANMEHRNOUSH,9000.0,9000.0,0.0,20.0,21600.0,2,"KARIMIAN, MEHRNOUSH",KARIMIAN  MEHRNOUSH,SOLE PROPRIETORSHIP,SMALL BUSINESS,SOLE PROPRIETORSHIP,2009
KARLSTORZGMBHCOKG,10585.0,10585.0,3.0,537.0,230000000.0,2,KARL STORZ ENDOSCOPY AMERICA INCORPORATED,KARL STORZ GMBH & CO. KG,,OTHER THAN SMALL BUSINESS,,2009
KARPINVESTMENTCORP,0.0,0.0,1.0,1.0,987647.0,1,KARP INVESTMENT CORP.,KARP INVESTMENT CORP.,,SMALL BUSINESS,,2009
KARSTPROFESSIONALSERVICESINC,0.0,0.0,999.0,6.0,1700000.0,1,"KARST PROFESSIONAL SERVICES, INC.","KARST PROFESSIONAL SERVICES, INC.",,SMALL BUSINESS,,2009
KASAMATSUDAVID,0.0,0.0,0.0,1.0,30000.0,1,"KASAMATSU, DAVID","KASAMATSU, DAVID",,SMALL BUSINESS,,2009
KASTLESYSTEMSLLC,36492.0,36492.0,1.0,210.0,21199500.0,1,KASTLE SYSTEMS LLC,KASTLE SYSTEMS LLC,,SMALL BUSINESS,,2009
KATHLEENCLEVINGER,6340.06,6340.06,3.0,2.0,10000.0,1,KATHLEEN CLEVINGER,KATHLEEN CLEVINGER,SOLE PROPRIETORSHIP,SMALL BUSINESS,SOLE PROPRIETORSHIP,2009
KATMANAGEMENTSERVICESINC,384000.0,384000.0,2.0,18.0,1000000.0,2,"KAT MANAGEMENT SERVICES, INC",KAT MANAGEMENT SERVICES  INC,,SMALL BUSINESS,,2009
KAYANDASSOCIATESINC,0.0,0.0,16.0,340.0,26866744.0,4,"KAY AND ASSOCIATES, INC.","KAY AND ASSOCIATES, INC.",,SMALL BUSINESS,,2009
KAYDONCORPORATION,6497.0,6497.0,1.0,3000.0,300000000.0,1,AVON BEARING CORPORATION,KAYDON CORPORATION,CORPORATE NOT TAX EXEMPT,OTHER THAN SMALL BUSINESS,CORPORATE NOT TAX EXEMPT,2009
KAYMONTCONSOLIDATEDINDUSTRIESINC,0.0,44712.0,2.0,4.0,2500000.0,1,KAYMONT CONSOLIDATED INDUSTRIES INC,KAYMONT CONSOLIDATED INDUSTRIES INC,OTHER,SMALL BUSINESS,OTHER,2009
KAYTHWEKHINE,0.0,0.0,0.0,1.0,1.0,1,KAY THWE KHINE,KAY THWE KHINE,SOLE PROPRIETORSHIP,SMALL BUSINESS,SOLE PROPRIETORSHIP,2009
KAZEMIINC,8320.0,0.0,0.0,1.0,1.0,2,"KAZEMI, INC.",KAZEMI  INC.,SOLE PROPRIETORSHIP,SMALL BUSINESS,SOLE PROPRIETORSHIP,2009
KBRINC,18229.879999999997,6830.0,21.0,7916.666666666667,1933666688.0,6,KELLOGG BROWN AND ROOT SERVICES INCORPORATED (1250),KBR  INC.,,OTHER THAN SMALL BUSINESS,,2009
KCIHOLDINGSINC,0.0,0.0,0.0,0.0,0.0,1,"KCI TECHNOLOGIES, INC",KCI HOLDINGS  INC,,OTHER THAN SMALL BUSINESS,,2009
KCONINC,800334.0,800334.0,1.0,30.0,13000000.0,1,K CON INCORPORATED,K-CON  INC.,,SMALL BUSINESS,,2009
KCPCHOLDINGSINC,0.0,0.0,1.0,880.0,40000000.0,1,CENTRAL PARKING SYSTEM INC,KCPC HOLDINGS  INC.,,OTHER THAN SMALL BUSINESS,,2009
KEAKITECHNOLOGIESLLC,662132.1,662132.1,1001.0,14.0,833333.3333333334,3,AKIMEKA TECHNOLOGIES LIMITED LIABILITY COMPANY,KE`AKI TECHNOLOGIES  LLC,,SMALL BUSINESS,,2009
KEANEINTERNATIONALINC,3699253.82,3699253.82,1.0,0.0,0.0,1,KEANE FEDERAL SYSTEMS INC,KEANE INTERNATIONAL  INC.,,OTHER THAN SMALL BUSINESS,,2009
KEARNEYCOMPANYPC,0.0,0.0,36.0,394.0,56896584.0,10,"KEARNEY & COMPANY, P.C.","KEARNEY & COMPANY, P.C.",,OTHER THAN SMALL BUSINESS,,2009
KEATTSENTERPRISESINC,11933.72,11933.72,35.0,1.0,325430.0,1,KEATTS' ENTERPRISES INC,KEATTS' ENTERPRISES INC,CORPORATE NOT TAX EXEMPT,SMALL BUSINESS,CORPORATE NOT TAX EXEMPT,2009
KECOINDUSTRIESINC,0.0,0.0,10.0,0.0,0.0,2,"KECO INDUSTRIES, INC","KECO INDUSTRIES, INC",,OTHER THAN SMALL BUSINESS,,2009
KEENANFTDETRICKENERGYLLC,0.0,0.0,6.0,1.0,1.0,3,KEENAN FT DETRICK ENERGY LIMITED LIABILITY COMPANY,KEENAN FT DETRICK ENERGY LLC,,OTHER THAN SMALL BUSINESS,,2009
KEITHCONTRACTINGLLC,0.0,0.0,12.0,23.0,6592807.0,4,"KEITH CONTRACTING, L.L.C.","KEITH CONTRACTING, L.L.C.",,OTHER THAN SMALL BUSINESS,,2009
KELLERGROUPPLC,33024940.36,33024940.36,0.0,864.0,25.0,1,HAYWARD BAKER INCORPORATED,KELLER GROUP P L C,,OTHER THAN SMALL BUSINESS,,2009
KELLSTROMAEROSPACELLC,91780.0,91780.0,8.0,195.0,51000000.0,3,KELLSTROM DEFENSE AEROSPACE INCORPORATED,KELLSTROM AEROSPACE  LLC,,SMALL BUSINESS,,2009
KELLYANDERSONASSOCIATESINC,0.0,0.0,11.0,15.0,8926520.0,3,KELLY ANDERSON AND ASSOCIATES INCORPORATED,"KELLY, ANDERSON & ASSOCIATES, INC.",,OTHER THAN SMALL BUSINESS,,2009
KELLYAVIATIONCENTERLP,0.0,0.0,6.0,140000.0,432000008192.0,3,"KELLY AVIATION CENTER, L.P","KELLY AVIATION CENTER, L.P",,OTHER THAN SMALL BUSINESS,,2009
KEMSCOINC,0.0,0.0,2.0,7.0,600000.0,1,KEMSCO INC,KEMSCO INC,,SMALL BUSINESS,,2009
KENMORTPROPERTIES,26401.52,26401.52,1.0,1.0,1816258.0,1,KENMORT PROPERTIES,KENMORT PROPERTIES,PARTNERSHIP,SMALL BUSINESS,PARTNERSHIP,2009
KENNETHTSANG,23800.0,23800.0,1.0,1.0,70000.0,1,KENNETH TSANG,KENNETH TSANG,SOLE PROPRIETORSHIP,SMALL BUSINESS,SOLE PROPRIETORSHIP,2009
KENOSHABEEFINTERNATIONALLTD,543514.95,543514.95,4.0,0.0,0.0,1,KENOSHA BEEF INTERNATIONAL LTD,KENOSHA BEEF INTERNATIONAL  LTD.,,OTHER THAN SMALL BUSINESS,,2009
KENSINGTONASSOCIATESLLC,0.0,0.0,0.0,6.0,1200000.0,1,"KENSINGTON ASSOCIATES, LLC","KENSINGTON ASSOCIATES, LLC",,SMALL BUSINESS,,2009
KENTASSOCIATESINC,0.0,0.0,2.0,7.0,1000000.0,1,"KENT ASSOCIATES, INC.","KENT ASSOCIATES, INC.",,SMALL BUSINESS,,2009
KENTUCKYBUILDINGMAINTENANCEINC,4683044.12,4683044.12,12.0,75.0,3285289.0,2,KENTUCKY BUILDING MAINTENANCE INC,KENTUCKY BUILDING MAINTENANCE INC,CORPORATE NOT TAX EXEMPT,OTHER THAN SMALL BUSINESS,CORPORATE NOT TAX EXEMPT,2009
KEYLOGICSYSTEMSINC,0.0,0.0,999.0,70.0,8378893.0,1,"KEYLOGIC SYSTEMS, INC.","KEYLOGIC SYSTEMS, INC.",,SMALL BUSINESS,,2009
KFORCEINC,0.0,0.0,11.0,1679.0,65.0,13,KFORCE GOVERNMENT SOLUTIONS INCORPORATED,KFORCE INC.,,SMALL BUSINESS,,2009
KGATLASVERMOGENSVERWALTUNGSGESELLSCHAFTCO,0.0,0.0,2.0,0.0,0.0,2,"COLLECTO, INC",KG ATLAS VERMOGENSVERWALTUNGSGESELLSCHAFT & CO.,,OTHER THAN SMALL BUSINESS,,2009
KHALILIANNIMA,18690.0,18690.0,0.0,1.0,31200.0,3,NIMA KHALILIAN,KHALILIAN  NIMA,SOLE PROPRIETORSHIP,SMALL BUSINESS,SOLE PROPRIETORSHIP,2009
KHATIBIJARMANFIROZE,16000.0,16000.0,1.0,1.0,28000.0,2,"KHATIBI JARMAN, FIROZE",KHATIBI JARMAN  FIROZE,SOLE PROPRIETORSHIP,SMALL BUSINESS,SOLE PROPRIETORSHIP,2009
KHPWASHINGTONHOTELLLC,67474.73,0.0,0.0,200.0,2564870.0,4,KHP WASHINGTON HOTEL LIMITED LIABILITY COMPANY,KHP WASHINGTON HOTEL LLC,,SMALL BUSINESS,,2009
KIGREINC,25149.2,25149.2,2.0,44.0,4000000.0,2,KIGRE INCORPORATED,KIGRE  INC.,,SMALL BUSINESS,,2009
KILLC,0.0,0.0,11.0,83.0,10000000.0,5,KI LIMITED LIABILITY COMPANY,"KI, LLC",,SMALL BUSINESS,,2009
KIMBALLINTERNATIONALINC,16814.079999999998,16814.079999999998,2.0,7600.0,1172504064.0,11,"KIMBALL INTERNATIONAL, INC","KIMBALL INTERNATIONAL, INC.",,OTHER THAN SMALL BUSINESS,,2009
KIMBERLYCLARKCORPORATION,0.0,0.0,1.0,58000.0,18000000000.0,1,KIMBERLY-CLARK CORPORATION,KIMBERLY-CLARK CORPORATION,,SMALL BUSINESS,,2009
KINCHINCORPORATED,90060.0,90060.0,3.0,25.0,2000000.0,3,KINCH INCORPORATED,KINCH  INCORPORATED,,SMALL BUSINESS,,2009
KINDREDHEALTHCAREINC,0.0,0.0,1.0,100.0,1245000.0,1,"KINDRED HEALTHCARE, INC.","KINDRED HEALTHCARE, INC.",,OTHER THAN SMALL BUSINESS,,2009
KINETICCONCEPTSINC,219260.63,219260.63,2.0,1710.0,763836032.0,2,KCI THERAPEUTIC SERVICES INCORPORATED,KINETIC CONCEPTS  INC.,,OTHER THAN SMALL BUSINESS,,2009
KINGFISHERCOINC,0.0,0.0,3.0,24.0,2580888.0,2,KING-FISHER COMPANY,"KING-FISHER CO., INC.",,SMALL BUSINESS,,2009
KINGMDJOSEPHC,0.0,0.0,0.0,1.0,50000.0,1,KING MD JOSEPH C,"KING M.D., JOSEPH C.",,SMALL BUSINESS,,2009
KINGSTREETSTATIONHOTELASSOCIATESLP,0.0,0.0,0.0,135000.0,6665000000.0,1,KING STREET STATION HOTEL ASSOCIATES LP,KING STREET STATION HOTEL ASSOCIATES LP,,OTHER THAN SMALL BUSINESS,,2009
KINGSUNIFORMSANDINDUSTRIALLAUNDRYINC,0.0,0.0,1.0,60.0,874566.0,1,KINGS UNIFORMS AND INDUSTRIAL LAUNDRY INCORPORATED,KINGS UNIFORMS AND INDUSTRIAL LAUNDRY INC,,SMALL BUSINESS,,2009
KINGSWAYSALESANDMARKETINGLLC,0.0,0.0,999.0,3.0,750000.0,1,KINGSWAY SALES AND MARKETING LIMITED LIABILITY COMPANY,KINGS WAY SALES AND MARKETING LLC,,SMALL BUSINESS,,2009
KINSETHHOTELCORPORATION,0.0,0.0,0.0,85.0,8000000.0,1,KINSETH HOTEL CORPORATION,KINSETH HOTEL CORPORATION,,OTHER THAN SMALL BUSINESS,,2009
KIRKWOODMOUNTAINRESORTSLLC,22850.0,22850.0,2.0,600.0,2000000.0,1,"KIRKWOOD MOUNTAIN RESORTS, LLC",KIRKWOOD MOUNTAIN RESORTS  LLC,,OTHER THAN SMALL BUSINESS,,2009
KISSELLFREDMNESAFETYCONSUL,0.0,0.0,0.0,1.0,30000.0,1,KISSELL FRED MNE SAFETY CONSUL,KISSELL FRED MNE SAFETY CONSUL,,SMALL BUSINESS,,2009
KISTLERINSTRUMENTCORPORATION,0.0,0.0,1.0,800.0,128000000.0,1,KISTLER INSTRUMENT CORP,KISTLER INSTRUMENT CORPORATION,,OTHER THAN SMALL BUSINESS,,2009
KITCHELLCORPORATION,5663.0,5663.0,2.0,1100.0,925000000.0,1,VIRGINIA REFRIGERATION SUPPLIES INC,KITCHELL CORPORATION,CORPORATE NOT TAX EXEMPT,OTHER THAN SMALL BUSINESS,CORPORATE NOT TAX EXEMPT,2009
KITLODGINGCOMPANYINC,17876.71,17876.71,6.0,0.0,0.0,3,LODGING KIT COMPANY,KIT LODGING COMPANY INC,,SMALL BUSINESS,,2009
KIZILDAGLIMEHMETAYDAN,54275.0,54275.0,1.0,1.0,1.0,1,"KIZILDAGLI, MEHMET AYDAN",KIZILDAGLI  MEHMET AYDAN,SOLE PROPRIETORSHIP,SMALL BUSINESS,SOLE PROPRIETORSHIP,2009
KJMACHINESFABLLC,34625.0,34625.0,1.0,1.0,500.0,1,KJ MACHINES & FAB LLC,KJ MACHINES & FAB LLC,,SMALL BUSINESS,,2009
KJSAFETYANDSECURITYCONSULTINGSVCSINC,0.0,0.0,1.0,8.0,300000.0,1,K&J SAFETY AND SECURITY CONSULTING SERVICES INCORPORATED,"K&J SAFETY AND SECURITY CONSULTING SVCS, INC.",,OTHER THAN SMALL BUSINESS,,2009
KLARQUISTSPARKMANLLP,1114941.33,1114941.33,17.0,128.0,20.0,17,"KLARQUIST SPARKMAN, LLP",KLARQUIST SPARKMAN  LLP,,OTHER THAN SMALL BUSINESS,,2009
KLAVONDESIGNASSOCIATESINC,31054.0,31054.0,8.0,4.0,600000.0,1,KLAVON DESIGN ASSOCIATES INC,KLAVON DESIGN ASSOCIATES  INC.,CORPORATE NOT TAX EXEMPT,SMALL BUSINESS,CORPORATE NOT TAX EXEMPT,2009
KLEANEKARETEAMINCTHE,0.0,4795583.0,1.0,55.0,1000000.0,1,"KLEANE KARE TEAM, INC., THE",KLEANE KARE TEAM  INC.  THE,OTHER,SMALL BUSINESS,OTHER,2009
KLMPRODUCTIONSINC,0.0,0.0,1.0,1.0,200000.0,1,K L M PRODUCTIONS INCORPORATED,K L M PRODUCTIONS INC,,SMALL BUSINESS,,2009
KMCHOLDINGSLLC,4419.06,4419.06,3.0,135.0,20000000.0,1,"KMC HOLDINGS, LLC",KMC HOLDINGS  LLC,,SMALL BUSINESS,,2009
KMTENTERPRISESLLC,0.0,0.0,3.0,150.0,7620278.0,4,"KM-T ENTERPRISES, LLC","KM-T ENTERPRISES, LLC",,SMALL BUSINESS,,2009
KNEZEVICVLADIMIR,0.0,0.0,0.0,1.0,15000.0,1,"KNEZEVIC, VLADIMIR","KNEZEVIC, VLADIMIR",SOLE PROPRIETORSHIP,OTHER THAN SMALL BUSINESS,SOLE PROPRIETORSHIP,2009
KNIGHTBEVERLYG,0.0,0.0,0.0,1.0,0.0,1,"KNIGHT, BEVERLY G","KNIGHT, BEVERLY G",,SMALL BUSINESS,,2009
KNIGHTPOINTSYSTEMSLLC,0.0,0.0,2.0,14.0,4500000.0,2,"KNIGHT POINT SYSTEMS, LLC","KNIGHT POINT SYSTEMS, LLC",,SMALL BUSINESS,,2009
KNIGHTPROTECTIVESERVICEINC,33780.03,33780.03,38.0,0.0,0.0,13,KNIGHT PROTECTIVE SERVICES INC,"KNIGHT PROTECTIVE SERVICE, INC.",,OTHER THAN SMALL BUSINESS,,2009
KNIGHTSKYCONSULTINGANDASSOCIATESLLC,0.0,2500000.0,999.0,11.0,4000000.0,1,"KNIGHT SKY CONSULTING AND ASSOCIATES, LLC",KNIGHT SKY CONSULTING AND ASSOCIATES  LLC,CORPORATE NOT TAX EXEMPT,SMALL BUSINESS,CORPORATE NOT TAX EXEMPT,2009
KNIGHTTHOMAS,0.0,0.0,0.0,1.0,117000.0,1,THOMAS KNIGHT,"KNIGHT, THOMAS",,SMALL BUSINESS,,2009
KNOLLINC,0.0,0.0,2.0,3863.0,773262976.0,1,KNOLL INC,"KNOLL, INC.",,OTHER THAN SMALL BUSINESS,,2009
KNOWLEDGEBASEDSYSTEMSINC,0.0,0.0,1.0,69.0,8430474.0,1,"KNOWLEDGE BASED SYSTEMS, INC.","KNOWLEDGE BASED SYSTEMS, INC.",,SMALL BUSINESS,,2009
KNOWLEDGEINFORMATIONSOLUTIONSINC,79355.04,79355.04,2.0,65.0,29.0,2,KNOWLEDGE INFORMATION SOLUTIONS INCORPORATED,KNOWLEDGE INFORMATION SOLUTIONS  INC.,,SMALL BUSINESS,,2009
KNULLC,0.0,0.0,999.0,200.0,150000000.0,1,LELAND MANUFACTURING LLC,"KNU, LLC",,SMALL BUSINESS,,2009
KOCSISTECHNOLOGIESINC,30786.15,30786.15,2.0,15.0,6600000.0,1,"KOCSIS TECHNOLOGIES, INC.",KOCSIS TECHNOLOGIES  INC.,OTHER,SMALL BUSINESS,OTHER,2009
KODIAKSUPPORTSERVICESJV,0.0,0.0,3.0,1.0,1.0,1,KODIAK SUPPORT SERVICES JV,KODIAK SUPPORT SERVICES JV,,SMALL BUSINESS,,2009
KOKATATINC,211118.12,211118.12,4.0,0.0,0.0,2,KOKATAT INC,KOKATAT INC.,,SMALL BUSINESS,,2009
KOMATSULTD,5190.0,5190.0,0.0,23.0,750000.0,1,"KOMATSU FORKLIFT HOLDINGS, INC",KOMATSU LTD.,,SMALL BUSINESS,,2009
KONEOYJ,0.0,0.0,61.0,0.0,0.0,34,KONE INC,KONE OYJ,,OTHER THAN SMALL BUSINESS,,2009
KONICAMINOLTAHOLDINGSINC,135871.16,151626.95,52.0,2021.4074074074074,661111111.1111112,28,KONICA MINOLTA BUSINESS SOLUTIONS USA INCORPORATED,KONICA MINOLTA HOLDINGS  INC.,,OTHER THAN SMALL BUSINESS,,2009
KONINKLIJKEPHILIPSELECTRONICSNV,0.0,0.0,10.0,21169.0,5973094346.666667,12,"MINI-MITTER COMPANY, INC.",KONINKLIJKE PHILIPS ELECTRONICS N.V.,,SMALL BUSINESS,,2009
KONTRONAG,6772.0,6772.0,1.0,210.0,140000000.0,1,"KONTRON AMERICA, INCORPORATED",KONTRON AG,CORPORATE NOT TAX EXEMPT,SMALL BUSINESS,CORPORATE NOT TAX EXEMPT,2009
KOOSHAREMLLC,0.0,0.0,48.0,800.0,530000000.0,8,WESTAFF (USA) INCORPORATED (5781),"KOOSHAREM, LLC",,OTHER THAN SMALL BUSINESS,,2009
KOSTROBORANA,10000.0,10000.0,1.0,1.0,38.0,2,"KOSTRO, BORANA",KOSTRO  BORANA,SOLE PROPRIETORSHIP,SMALL BUSINESS,SOLE PROPRIETORSHIP,2009
KOVACHTHOMASGRACEA,0.0,0.0,0.0,0.0,20342.0,1,"KOVACH-THOMAS, GRACE A","KOVACH-THOMAS, GRACE A",,SMALL BUSINESS,,2009
KOYITLOTSINALIMITED,0.0,0.0,5.0,311.2,14400000.0,5,BROOKS RANGE CONTRACT SERVICES INCORPORATED,K'OYITL'OTS'INA LIMITED,,SMALL BUSINESS,,2009
KPMGLLP,7064910.26,7064910.26,20.0,503.0,18461542.692307692,13,KPMG LLP,KPMG L.L.P.,,OTHER THAN SMALL BUSINESS,,2009
KRASITYSMEDICALSURGICALSUPPLYINC,0.0,0.0,6.0,20.0,7000000.0,6,KRASITYS MEDICAL AND SURGICAL SUPPLY,"KRASITY'S MEDICAL & SURGICAL SUPPLY, INC.",,SMALL BUSINESS,,2009
KRATOSDEFENSESECURITYSOLUTIONSINC,237127434.43,363618081.82000005,145.0,542.4285714285714,66814288.571428575,21,DTI ASSOCIATES INCORPORATED,KRATOS DEFENSE & SECURITY SOLUTIONS  INC.,,OTHER THAN SMALL BUSINESS,,2009
KRCUSTOMSOFTWAREINC,23069.0,23069.0,0.0,6.0,986000.0,2,K & R CUSTOM SOFTWARE INC,K & R CUSTOM SOFTWARE  INC.,,SMALL BUSINESS,,2009
KRUEGERINTERNATIONALINC,82598.0,82598.0,1.0,2500.0,50000000.0,1,SPACESAVER STORAGE SYSTEMS INCORPORATED,KRUEGER INTERNATIONAL  INC.,,OTHER THAN SMALL BUSINESS,,2009
KRUJAERJON,14080.0,14080.0,1.0,1.0,36.0,2,"KRUJA, ERJON","KRUJA, ERJON",SOLE PROPRIETORSHIP,OTHER THAN SMALL BUSINESS,SOLE PROPRIETORSHIP,2009
KRUMANEQUIPMENTCOMPANY,0.0,0.0,1.0,16.0,6000000.0,1,KRUMAN EQUIPMENT COMPANY,KRUMAN EQUIPMENT COMPANY,,SMALL BUSINESS,,2009
KSJASSOCIATESINC,8159703.18,11135495.74,4.0,65.0,9802121.0,3,"K S J & ASSOCIATES, INC","KSJ & ASSOCIATES, INC.",,SMALL BUSINESS,,2009
KTCONSULTINGINC,0.0,0.0,9.0,125.0,8000000.0,1,"KT CONSULTING, INC.","KT CONSULTING, INC.",,SMALL BUSINESS,,2009
KTECHCORPORATION,729944.0,729944.0,10.0,412.0,55000000.0,1,KTECH CORPORATION,KTECH CORPORATION,CORPORATE NOT TAX EXEMPT,SMALL BUSINESS,CORPORATE NOT TAX EXEMPT,2009
KTPSHOLDINGSLLC,0.0,0.0,1.0,0.0,0.0,1,RAY ALLEN MANUFACTURING CO INC,KTPS HOLDINGS LLC,,OTHER THAN SMALL BUSINESS,,2009
KUCHTAMININGSERVICES,0.0,0.0,2.0,1.0,10000.0,2,KUCHTA MINING SERVICES,KUCHTA MINING SERVICES,,SMALL BUSINESS,,2009
KUHANASPECTRUMHEALTHJOINTVENTURELLC,252512.85,252512.85,75.0,2.0,1.0,5,"KUHANA SPECTRUM HEALTH JOINT VENTURE, LLC","KUHANA SPECTRUM HEALTH JOINT VENTURE, LLC",,SMALL BUSINESS,,2009
KUHANASPECTRUMJOINTVENTURE8ALLC,179211.36,179211.36,31.0,1.0,1.0,2,KUHANA-SPECTRUM JOINT VENTURE 8A,KUHANA-SPECTRUM JOINT VENTURE 8A  LLC,PARTNERSHIP,SMALL BUSINESS,PARTNERSHIP,2009
KUHANASPECTRUMJOINTVENTURELLC,1451886.1,1451886.1,7.0,2.0,1.0,1,"KUHANA-SPECTRUM JOINT VENTURE, LLC",KUHANA-SPECTRUM JOINT VENTURE  LLC,PARTNERSHIP,SMALL BUSINESS,PARTNERSHIP,2009
KUTTATECHNOLOGIESINC,0.0,0.0,4.0,18.0,4000000.0,1,"KUTTA CONSULTING, INC.","KUTTA TECHNOLOGIES, INC.",,SMALL BUSINESS,,2009
KWAKHYUN,0.0,0.0,0.0,1.0,1.0,2,"KWAK, HYUN",KWAK  HYUN,SOLE PROPRIETORSHIP,SMALL BUSINESS,SOLE PROPRIETORSHIP,2009
KWGINDUSTRIESLLC,3516.0,3516.0,3.0,25.0,4500000.0,1,"KWG INDUSTRIES, L.L.C.",KWG INDUSTRIES L.L.C.,PARTNERSHIP,SMALL BUSINESS,PARTNERSHIP,2009
KWIKSPACEGUAMINC,0.0,0.0,0.0,15.0,900000.0,3,KWIK SPACE GUAM INC,KWIKSPACE GUAM INC,,SMALL BUSINESS,,2009
KYOCERACORPORATION,0.0,0.0,7.0,10000.0,2500000000.0,4,KYOCERA MITA AMERICA INC,KYOCERA CORPORATION,,OTHER THAN SMALL BUSINESS,,2009
L1IDENTITYSOLUTIONSINC,18578658.3,18578658.3,5.0,778.25,126536300.0,4,IDENTIX INCORPORATED,"L-1 IDENTITY SOLUTIONS, INC.",,OTHER THAN SMALL BUSINESS,,2009
L3COMMUNICATIONSHOLDINGSINC,1858876890.3,15701699385.180002,724.0,29712.373665480427,3755671597.58363,281,INSIGHT TECHNOLOGY INCORPORATED,L-3 COMMUNICATIONS HOLDINGS  INC.,,OTHER THAN SMALL BUSINESS,,2009
LABARGEPRODUCTSINC,11851222.62,11851222.62,12.0,45.0,5000000.0,2,LABARGE PRODUCTS INCORPORATED,LABARGE PRODUCTS  INC.,,SMALL BUSINESS,,2009
LABATTINSTITUTIONALSUPPLYCOMPANYINC,4211.97,4211.97,1.0,190.0,85000000.0,1,"ZANIOS FOODS ,INC",LABATT INSTITUTIONAL SUPPLY COMPANY  INC,CORPORATE NOT TAX EXEMPT,SMALL BUSINESS,CORPORATE NOT TAX EXEMPT,2009
LABELGRAPHICSMANUFACTURINGINC,0.0,0.0,1.0,0.0,0.0,1,"LABEL GRAPHICS MANUFACTURING, INC.",LABEL GRAPHICS MANUFACTURING INC,,OTHER THAN SMALL BUSINESS,,2009
LABICHEARCHITECTURALGROUPINCTHE,0.0,0.0,2.0,8.0,100000.0,2,LABICHE ARCHITECTURAL GROUP INCORPORATED THE,"LABICHE ARCHITECTURAL GROUP INC, THE",,SMALL BUSINESS,,2009
LABORATORYCORPORATIONOFAMERICAHOLDINGS,0.0,0.0,0.0,26000.0,4100000000.0,1,LABORATORY CORPORATION OF AMERICA,LABORATORY CORPORATION OF AMERICA HOLDINGS,,OTHER THAN SMALL BUSINESS,,2009
LADYSLIPPERINC,9600.0,9600.0,1.0,1.0,30000.0,1,LADY SLIPPER INC,LADY SLIPPER INC,CORPORATE NOT TAX EXEMPT,SMALL BUSINESS,CORPORATE NOT TAX EXEMPT,2009
LAGUNACONSTRUCTIONCOMPANYINC,6356644.09,6356644.09,31.0,0.0,0.0,1,LAGUNA CONSTRUCTION CO INC,"LAGUNA CONSTRUCTION COMPANY, INC.",,OTHER THAN SMALL BUSINESS,,2009
LAGUNAINDUSTRIESINC,0.0,0.0,2.0,0.0,0.0,2,LAGUNA INDUSTRIES INC,"LAGUNA INDUSTRIES, INC.",,SMALL BUSINESS,,2009
LAJASRACINGINC,0.0,0.0,4.0,69.0,2600000.0,2,LAJAS RACING INC,LAJAS RACING INC,,SMALL BUSINESS,,2009
LAKESHOREENGINEERINGSERVICESINC,3536663.55,3536663.55,131.0,111.57142857142857,39083329.14285714,7,"TOLTEST, INC",LAKESHORE ENGINEERING SERVICES  INC.,,SMALL BUSINESS,,2009
LAKESIDEFOODINC,283808.3,283808.3,6.0,4.0,10755650.0,1,LAKESIDE FOOD INC,LAKESIDE FOOD INC,CORPORATE NOT TAX EXEMPT,SMALL BUSINESS,CORPORATE NOT TAX EXEMPT,2009
LAKOTACONTRACTINGINC,4351.0,4351.0,2.0,5.0,316464.0,1,"LAKOTA CONTRACTING, INC.",LAKOTA CONTRACTING INC,,SMALL BUSINESS,,2009
LAKOTAENTERPRISESINC,0.0,0.0,5995.0,6.0,3000000.0,7,LAKOTA ENTERPRISES INCORPORATED,"LAKOTA ENTERPRISES, INC.",,SMALL BUSINESS,,2009
LANDMARKFBOLLC,0.0,0.0,16.0,0.0,0.0,1,ENCORE SUPPORT SYSTEMS LP.,LANDMARK FBO  LLC,,OTHER THAN SMALL BUSINESS,,2009
LANDSTARSYSTEMINC,0.0,0.0,0.0,1304.0,2613846016.0,1,LANDSTAR EXPRESS AMERICA INC,LANDSTAR SYSTEM  INC.,,OTHER THAN SMALL BUSINESS,,2009
LANDYBIORESOURCESLLC,0.0,0.0,0.0,4.0,18000.0,1,LANDY BIO RESOURCES LIMITED LIABILITY COMPANY,"LANDY BIORESOURCES, LLC",,SMALL BUSINESS,,2009
LANGDONINC,0.0,0.0,28.0,47.0,9000000.0,7,LANGDON INCORPORATED,"LANGDON, INC.",,SMALL BUSINESS,,2009
LANSINGSQUAREDINC,0.0,0.0,0.0,1.0,55000.0,1,LANSING SQUARED INC,LANSING SQUARED INC,,SMALL BUSINESS,,2009
LANTANACONSULTINGGROUPLLC,0.0,0.0,2.0,2.0,550000.0,2,"ALSCHULER ASSOCIATES, LLC","LANTANA CONSULTING GROUP, LLC",,SMALL BUSINESS,,2009
LAPAZREGIONALHOSPITALINC,37859.0,37859.0,1.0,159.0,52060349.0,1,"LA PAZ REGIONAL HOSPITAL, INC",LA PAZ REGIONAL HOSPITAL  INC.,CORPORATE TAX EXEMPT,OTHER THAN SMALL BUSINESS,CORPORATE TAX EXEMPT,2009
LAPMASTERINTERNATIONALLLC,0.0,0.0,1.0,40.0,12000000.0,1,"LAPMASTER INTERNATIONAL, LLC",LAPMASTER INTERNATIONAL  LLC,OTHER,SMALL BUSINESS,OTHER,2009
LAPRIMAFOODGROUPINC,0.0,0.0,1.0,150.0,11000000.0,1,"LA PRIMA FOOD GROUP, INC","LA PRIMA FOOD GROUP, INC",,OTHER THAN SMALL BUSINESS,,2009
LARAMBLAPLAZACORP,0.0,0.0,18.0,8.0,2700000.0,6,LA RAMBLA PLAZA CORP,LA RAMBLA PLAZA CORP,,SMALL BUSINESS,,2009
LASALLEHOTELPROPERTIES,156644.65,0.0,0.0,180.0,14000000.0,8,LNR ALEXANDRIA LIMITED PARTNERSHIP,LASALLE HOTEL PROPERTIES,,SMALL BUSINESS,,2009
LASALLEHOTELPROPERTIESINC,0.0,0.0,0.0,128000.0,9000000000.0,1,LASALLE HOTEL PROPERTIES,"LASALLE HOTEL PROPERTIES, INC.",,OTHER THAN SMALL BUSINESS,,2009
LASELLHORACEJ,10566924.0,10566924.0,4.0,0.0,0.0,2,STRATEGIC ENGINEERING SYSTEMS,LASELL  HORACE J,,SMALL BUSINESS,,2009
LASERTECHNOLOGYINC,0.0,0.0,1.0,86.0,10491400.0,1,LASER TECHNOLOGY INCORPORATED (0494),"LASER TECHNOLOGY, INC.",,SMALL BUSINESS,,2009
LATAPARALLAXPORTSMOUTHLLC,0.0,0.0,48.0,100.0,28000000.0,8,LATA/PARALLAX PORTSMOUTH LIMITED LIABILITY COMPANY,"LATA/PARALLAX PORTSMOUTH, LLC",,SMALL BUSINESS,,2009
LATASHARPREMEDIATIONSERVICESLLC,38186.56,38186.56,6.0,55.0,3000000.0,1,LATA SHARP REMEDIATION SERVICES LIMITED LIABILITY COMPANY,LATA - SHARP REMEDIATION SERVICES  LLC,,SMALL BUSINESS,,2009
LATINOCIVILRIGHTSCENTERINC,0.0,0.0,2.0,3.0,200000.0,1,LATINO CIVIL RIGHTS CENTER INC,LATINO CIVIL RIGHTS CENTER INC,,OTHER THAN SMALL BUSINESS,,2009
LAUDERDALECOUNTYOF,0.0,0.0,1.0,400.0,41000000.0,1,COUNTY OF LAUDERDALE,"LAUDERDALE, COUNTY OF",,OTHER THAN SMALL BUSINESS,,2009
LAVENDERBRENDA,0.0,0.0,1.0,1.0,9000.0,1,LAVENDER BRENDA,"LAVENDER, BRENDA",,OTHER THAN SMALL BUSINESS,,2009
LAWRENCESTREETINDUSTRYLLC,0.0,0.0,2.0,28.0,4200000.0,1,"LAWRENCE STREET INDUSTRY, LLC","LAWRENCE STREET INDUSTRY, LLC",,SMALL BUSINESS,,2009
LAWRENCEVIRGINIA,0.0,0.0,0.0,1.0,40.0,1,"LAWRENCE, VIRGINIA",LAWRENCE  VIRGINIA,SOLE PROPRIETORSHIP,SMALL BUSINESS,SOLE PROPRIETORSHIP,2009
LAWSONPRODUCTSINC,406629.23000000016,406629.23000000016,60944.0,1440.0,387455904.0,64,"LAWSON PRODUCTS, INC.",LAWSON PRODUCTS  INC.,,OTHER THAN SMALL BUSINESS,,2009
LAWSONSPROFESSIONALCLEANINGSERVICESINC,99000.0,99000.0,10.0,5.0,125000.0,2,LAWSONS PROFESSIONAL CLEANING SERVICES INCORPORATED,LAWSON'S PROFESSIONAL CLEANING SERVICES  INC.,,SMALL BUSINESS,,2009
LAZARORDOMINGUEZ,0.0,0.0,3.0,1.0,48655.0,1,LAZARO R DOMINGUEZ,LAZARO R DOMINGUEZ,SOLE PROPRIETORSHIP,OTHER THAN SMALL BUSINESS,SOLE PROPRIETORSHIP,2009
LAZERCARTRIDGESPLUSLLC,72120.11,102025.11000000002,22984.0,1.0,89000.0,26,"LAZER CARTRIDGES PLUS, LLC",LAZER CARTRIDGES PLUS LLC,,SMALL BUSINESS,,2009
LAZPARKLLC,13980.0,13980.0,1.0,2800.0,120000000.0,1,"LAZ PARKING LTD, LLC",LAZ PARK LLC,,SMALL BUSINESS,,2009
LAZZARACHARLESP,0.0,0.0,1.0,1.0,8000.0,2,"LAZZARA, CHARLES P","LAZZARA, CHARLES P",,SMALL BUSINESS,,2009
LBBASSOCIATESINC,44756566.8,54273854.77,24.0,806.5,11000005.0,10,L B AND B ASSOCIATES INCORPORATED (8228),L B & B ASSOCIATES INC.,,OTHER THAN SMALL BUSINESS,,2009
LCINDUSTRIESINC,30904.3,30904.3,1006.0,248.75,1.0,8,"L C IND, INC.",LC INDUSTRIES  INC.,,OTHER THAN SMALL BUSINESS,,2009
LEADERCOMMUNICATIONSINC,3759806.87,3759806.87,20.0,354.0,25.0,4,LEADER COMMUNICATIONS INCORPORATED,LEADER COMMUNICATIONS  INC.,,SMALL BUSINESS,,2009
LEADERSHIPSTRATEGIESINC,960512.56,960512.56,2.0,10.0,1000000.0,1,LEADERSHIP STRATEGIES INCORPORATED,LEADERSHIP STRATEGIES INC,,SMALL BUSINESS,,2009
LEADERSLLCTHE,0.0,0.0,3.0,35.0,7058724.0,1,"LEADERS, LLC, THE","LEADERS, LLC, THE",,SMALL BUSINESS,,2009
LEAFINTERNATIONALCOLIMITED,1862.0,25137.0,4.0,89.0,9904309.0,2,"FOREMOST FOODS, INC",LEAF INTERNATIONAL CO.  LIMITED,,OTHER THAN SMALL BUSINESS,,2009
LEARFIELDCOMMUNICATIONSINC,3120.0,3120.0,1.0,300.0,125000000.0,1,"LEARFIELD COMMUNICATIONS, INC.",LEARFIELD COMMUNICATIONS  INC.,,OTHER THAN SMALL BUSINESS,,2009
LEARNINGTREEINTERNATIONALINC,0.0,0.0,1.0,0.0,0.0,1,"LEARNING TREE INTERNATIONAL, U",LEARNING TREE INTERNATIONAL  INC.,,OTHER THAN SMALL BUSINESS,,2009
LEATHERWOODELECTRONICSMFGINC,10207.0,10207.0,3.0,45.0,7000000.0,1,"LEATHERWOOD ELECTRONICS & MFG., INC.",LEATHERWOOD ELECTRONICS & MFG.  INC.,OTHER,SMALL BUSINESS,OTHER,2009
LEAVENWORTHJEFFERSONELECTRICALCOOPERATIVEINC,189059323.46,278067886.61,4.0,20.0,6666666.666666667,3,LEAVENWORTH-JEFFERSON ELECTRICAL COOPERATIVE INC,LEAVENWORTH-JEFFERSON ELECTRICAL COOPERATIVE INC,,OTHER THAN SMALL BUSINESS,,2009
LEAVITTSMONTANAENTERPRISESLLC,649579.88,6188523.96,1.0,1.0,348042.0,1,"LEAVITT'S MONTANA ENTERPRISES, L.L.C.",LEAVITT'S MONTANA ENTERPRISES  L.L.C.,PARTNERSHIP,SMALL BUSINESS,PARTNERSHIP,2009
LEESCARPETSINTERIORSINC,11380.0,11380.0,0.0,3.0,550000.0,1,LEE'S CARPETS & INTERIORS INC,LEE'S CARPETS & INTERIORS INC,,SMALL BUSINESS,,2009
LEESOOJIN,0.0,0.0,0.0,1.0,7600.0,1,"LEE, SOOJIN","LEE, SOOJIN",SOLE PROPRIETORSHIP,OTHER THAN SMALL BUSINESS,SOLE PROPRIETORSHIP,2009
LEEYOOKYUNG,0.0,0.0,0.0,1.0,0.0,1,"LEE, YOOKYUNG",LEE  YOOKYUNG,SOLE PROPRIETORSHIP,OTHER THAN SMALL BUSINESS,SOLE PROPRIETORSHIP,2009
LEFEBVRECONSULTINGGROUP,0.0,0.0,1.0,1.0,70000.0,1,LEFEBVRE CONSULTING GROUP,LEFEBVRE CONSULTING GROUP,,SMALL BUSINESS,,2009
LEGACYSEAPRODUCTSLLC,61059.5,61059.5,1.0,41.0,13000000.0,1,LEGACY SEA PRODUCTS LIMITED LIABILITY COMPANY,"LEGACY SEA PRODUCTS, LLC",,SMALL BUSINESS,,2009
LEGENDPUBLISHINGCOMPANY,49440.0,49440.0,1.0,0.0,0.0,1,LEGEND PUBLISHING COMPANY,LEGEND PUBLISHING COMPANY,,SMALL BUSINESS,,2009
LEIDOSHOLDINGSINC,0.0,0.0,2500.0,21266.64,4418286222.36,200,SCIENCE APPLICATIONS INTERNATIONAL CORPORATION,"LEIDOS HOLDINGS, INC.",,OTHER THAN SMALL BUSINESS,,2009
LEIDOSINC,0.0,0.0,12.0,44000.0,8300000256.0,15,SCIENCE APPLICATIONS INTERNATIONAL CORPORATION,"LEIDOS, INC.",,OTHER THAN SMALL BUSINESS,,2009
LELANDSTANFORDJUNIORUNIVERSITY,35910000000.0,35910000000.0,0.0,14000.0,1473890048.0,3,STANFORD UNIVERSITY,LELAND STANFORD JUNIOR UNIVERSITY,,OTHER THAN SMALL BUSINESS,,2009
LENOVOGROUPLIMITED,0.0,0.0,0.0,19000.0,12999999488.0,1,LENOVO (UNITED STATES) INC.,LENOVO GROUP LIMITED,,OTHER THAN SMALL BUSINESS,,2009
LEOADALYCOMPANY,0.0,0.0,1.0,25.0,1750000.0,1,LEO A DALY COMPANY,LEO A DALY COMPANY,,OTHER THAN SMALL BUSINESS,,2009
LEONARDOSPA,0.0,0.0,2.0,75000.0,24000000000.0,1,"DRS NETWORK & IMAGING SYSTEMS, LLC",LEONARDO SPA,,OTHER THAN SMALL BUSINESS,,2009
LESWILKINSASSOCIATESINC,0.0,0.0,6.0,8.0,1836000.0,2,LES WILKINS & ASSOCIATES INC,LES WILKINS & ASSOCIATES INC,,SMALL BUSINESS,,2009
LETSGOTOWORKINC,59136.84,148648.8,1.0,6.0,75000.0,1,"LETS GO TO WORK, INC",LETS GO TO WORK  INC,,OTHER THAN SMALL BUSINESS,,2009
LEVEL3COMMUNICATIONSINC,2894.9300000000003,2894.9300000000003,7.0,9885.714285714286,5771428608.0,7,"LEVEL 3 COMMUNICATIONS, LLC",LEVEL 3 COMMUNICATIONS  INC.,OTHER,OTHER THAN SMALL BUSINESS,OTHER,2009
LEVINALEKSEY,7000.0,7000.0,1.0,1.0,1.0,2,"LEVIN, ALEKSEY","LEVIN, ALEKSEY",SOLE PROPRIETORSHIP,OTHER THAN SMALL BUSINESS,SOLE PROPRIETORSHIP,2009
