recipient_parent_name1,current_total_value_of_award,potential_total_value_of_award,number_of_offers_received,number_of_employees,annual_revenue,awards_counts,recipient_name,recipient_parent_name,organizational_type,contracting_officers_determination_of_business_size,organizational_type,year
DAHCONSULTINGINC,0.0,1674397.5,44.0,15.0,2.0,1,DAH CONSULTING INCORPORATED,DAH CONSULTING INC.,,SMALL BUSINESS,,2009
DAHLENORTHAMERICAINC,29150.199999999997,29150.199999999997,2002.0,16.0,6000000.0,4,DAHLE NORTH AMERICA INCORPORATED,DAHLE NORTH AMERICA INC,,SMALL BUSINESS,,2009
DAILYDISPOSALSERVICESINC,15435.0,15435.0,2.0,38.0,5500000.0,1,"DAILY DISPOSAL SERVICES, INC.","DAILY DISPOSAL SERVICES, INC.",,SMALL BUSINESS,,2009
DAILYMAILGENERALTRUSTPLC,0.0,0.0,1.0,122.0,23900000.0,1,"GENSCAPE, INC.",DAILY MAIL & GENERAL TRUST P L C,,OTHER THAN SMALL BUSINESS,,2009
DAIMLERAG,5822.21,5822.21,1.0,400.0,110000000.0,1,"FLORIDA DETROIT DIESEL - ALLISON, INC.",DAIMLER AG,CORPORATE NOT TAX EXEMPT,OTHER THAN SMALL BUSINESS,CORPORATE NOT TAX EXEMPT,2009
DAIRYMAIDDAIRYINC,491371.21,491371.21,3.0,0.0,0.0,1,DAIRY MAID DAIRY INC,DAIRY MAID DAIRY  INC.,,SMALL BUSINESS,,2009
DALEROGERSTRAININGCENTERINC,0.0,0.0,1.0,0.0,0.0,1,OKLAHOMA COUNTY COUNCIL FOR ME,"DALE ROGERS TRAINING CENTER, INC.",,OTHER THAN SMALL BUSINESS,,2009
DALEWALZELCONSTRUCTION,95298.5,95298.5,3.0,0.0,18000000.0,1,DALE WALZEL CONSTRUCTION,DALE WALZEL CONSTRUCTION,,SMALL BUSINESS,,2009
DAMIANOCATALDIMAINTENANCESERVICESINC,0.0,0.0,12.0,15.0,6.0,4,"DAMIANO CATALDI MAINTENANCE SERVICES, INC.","DAMIANO CATALDI MAINTENANCE SERVICES, INC.",,SMALL BUSINESS,,2009
DANAHERCORPORATION,1098611.82,1773395.52,1014.0,14125.333333333334,2842432815.0666666,15,FLUKE ELECTRONICS CORPORATION,DANAHER CORPORATION,,OTHER THAN SMALL BUSINESS,,2009
DANFIEDLER,254721.4,254721.4,1.0,12.0,500000.0,1,DAN FIEDLER,DAN FIEDLER,SOLE PROPRIETORSHIP,SMALL BUSINESS,SOLE PROPRIETORSHIP,2009
DANIELEKEANDASSOCIATESPC,0.0,0.0,0.0,13.0,989053.0,1,"DANIEL EKE AND ASSOCIATES, P.C","DANIEL EKE AND ASSOCIATES, P.C.",,SMALL BUSINESS,,2009
DANIELHWAGNERASSOCIATESINCORPORATED,99999.92,99999.92,2.0,32.0,5851000.0,1,"DANIEL H. WAGNER ASSOCIATES, INCORPORATED",DANIEL H. WAGNER ASSOCIATES  INCORPORATED,CORPORATE NOT TAX EXEMPT,SMALL BUSINESS,CORPORATE NOT TAX EXEMPT,2009
DANKAHOLDINGCOMPANY,0.0,0.0,1.0,2134.0,500000000.0,1,DANKA HOLDING COMPANY (7614),DANKA HOLDING COMPANY,,OTHER THAN SMALL BUSINESS,,2009
DANOFFANDDONNELLYATTORNEYSATLAW,0.0,0.0,0.0,4.0,220000.0,1,DANOFF AND DONNELLY ATTORNEYS,DANOFF AND DONNELLY ATTORNEYS AT LAW,,SMALL BUSINESS,,2009
DANYAINTERNATIONALINC,29148.0,29148.0,2.0,146.66666666666666,19719451.333333332,3,DANYA INTERNATIONAL INCORPORATED,DANYA INTERNATIONAL INC.,,SMALL BUSINESS,,2009
DARCENATASHA,9560.0,9560.0,3.0,2.0,140000.0,1,"DARCE, NATASHA",DARCE  NATASHA,,SMALL BUSINESS,,2009
DARIASIDOLIDIA,0.0,0.0,3.0,1.0,1.0,1,"DARIAS, IDOLIDIA",DARIAS  IDOLIDIA,SOLE PROPRIETORSHIP,SMALL BUSINESS,SOLE PROPRIETORSHIP,2009
DARLENECASIASINTERIORSLP,49500.0,49500.0,1.0,3.0,800000.0,1,"CASIAS, DARLENE INTERIORS LP",DARLENE CASIAS INTERIORS  L.P.,PARTNERSHIP,SMALL BUSINESS,PARTNERSHIP,2009
DASNETCORPORATION,0.0,0.0,3.0,25.0,18000000.0,1,DASNET CORPORATION,DASNET CORPORATION,,SMALL BUSINESS,,2009
DATABANKINC,0.0,0.0,0.0,50.0,4000000.0,1,"DATABANK, INC","DATABANK, INC.",,SMALL BUSINESS,,2009
DATABITINC,13466.25,13466.25,3.0,25.0,18000000.0,1,DATABIT INCORPORATED,DATABIT INC,,SMALL BUSINESS,,2009
DATACOMINC,81250.0,81250.0,1.0,20.0,3500000.0,1,DATACOM INCORPORATED,DATACOM INC,,OTHER THAN SMALL BUSINESS,,2009
DATACONVERSIONLABORATORYINC,0.0,0.0,0.0,45.0,5000000.0,1,DATA CONVERSION LABORATORY INC,"DATA CONVERSION LABORATORY, INC.",,SMALL BUSINESS,,2009
DATALINKASSOCIATESINC,0.0,0.0,2.0,5.0,3200000.0,1,DATA LINK ASSOCIATES INCORPORATED,"DATA-LINK ASSOCIATES, INC.",,SMALL BUSINESS,,2009
DATALINKSOLUTIONSLLC,384918.0,103200479.0,5.0,0.0,0.0,5,BAE SYSTEMS/ROCKWELL COLLINS,DATA LINK SOLUTIONS L.L.C.,,OTHER THAN SMALL BUSINESS,,2009
DATAMAXXGROUPINC,1274119.2,1274119.2,1.0,103.0,23000000.0,1,DATAMAXX GROUP INCORPORATED,DATAMAXX GROUP  INC.,,SMALL BUSINESS,,2009
DATANETWORKSINC,0.0,0.0,2.0,26.0,4395064.0,2,"DATA NETWORKS, INC","DATA NETWORKS, INC.",,SMALL BUSINESS,,2009
DATAPAGESINC,0.0,0.0,3000.0,10.0,4100000.0,5,DATA PAGES INCORPORATED,"DATA-PAGES, INC.",,SMALL BUSINESS,,2009
DATARESEARCHANDANALYSISCORPORATION,2574843.19,2574843.19,3.0,0.0,0.0,1,DATA RESEARCH AND ANALYSIS COR,DATA RESEARCH AND ANALYSIS CORPORATION,,SMALL BUSINESS,,2009
DATASCIENCEAUTOMATIONINC,63470.25,63470.25,2.0,0.0,0.0,2,"DATA SCIENCE AUTOMATION, INC.",DATA SCIENCE AUTOMATION  INC.,,SMALL BUSINESS,,2009
DATASYSTEMSANALYSTSINC,0.0,0.0,6.0,180.0,29442412.0,2,"DATA SYSTEMS ANALYSTS, INC.","DATA SYSTEMS ANALYSTS, INC.",,SMALL BUSINESS,,2009
DATASYSTEMSHARDWAREINC,2790.0,2790.0,14.0,16.833333333333332,2916666.6666666665,6,"DATA SYSTEMS HARDWARE, INC",DATA SYSTEMS HARDWARE INC.,,SMALL BUSINESS,,2009
DAUMMDROBERTS,0.0,0.0,0.0,9200.0,76.0,1,UNIVERSITY OF CHICAGO THE (7139),"DAUM MD, ROBERT S.",,SMALL BUSINESS,,2009
DAVIDARMSTERGENERALCONTRACTORINC,98384.19,98384.19,3.0,7.0,4553320.0,1,ARMSTER DAVID,DAVID ARMSTER GENERAL CONTRACTOR  INC.,,SMALL BUSINESS,,2009
DAVIDJOSEPHEASTERBROOKLTD,0.0,0.0,3.0,5.0,3000000.0,1,DAVID JOSEPH EASTERBROOK LIMITED,DAVID JOSEPH EASTERBROOK LTD.,,SMALL BUSINESS,,2009
DAVIDSONHOTELCOMPANY,38828.44,0.0,0.0,124.0,14800000.0,2,DAVIDSON HOTEL COMPANY,DAVIDSON HOTEL COMPANY,CORPORATE NOT TAX EXEMPT,OTHER THAN SMALL BUSINESS,CORPORATE NOT TAX EXEMPT,2009
DAVISHAROLDELECTRICINC,4590.0,4590.0,2.0,1.0,60.0,1,"DAVIS, HAROLD ELECTRIC INC",DAVIS  HAROLD ELECTRIC INC,,SMALL BUSINESS,,2009
DAVISMEMORIALGOODWILLINDUSTRIES,0.0,0.0,1.0,520.0,23200000.0,1,DAVIS MEMORIAL GOODWILL INDUSTRIES INC,DAVIS MEMORIAL GOODWILL INDUSTRIES,,OTHER THAN SMALL BUSINESS,,2009
DAVISSCHOOLDISTRICT,11153440.52,11153440.52,2.0,6310.0,279427008.0,2,DAVIS SCHOOL DISTRICT,DAVIS SCHOOL DISTRICT,,OTHER THAN SMALL BUSINESS,,2009
DAVPRIMEVANTEXSERVICEJOINTVENTURE,89439.6,89439.6,3.0,1.0,1.0,1,DAV PRIME/VANTEX SERVICE JOINT VENTURE,DAV PRIME/VANTEX SERVICE JOINT VENTURE,CORPORATE NOT TAX EXEMPT,SMALL BUSINESS,CORPORATE NOT TAX EXEMPT,2009
DAYZIMMERMANNGROUPINCTHE,0.0,0.0,2.0,24000.0,2200000.0,2,"DAY & ZIMMERMANN GROUP INC., THE","DAY & ZIMMERMANN GROUP INC., THE",,OTHER THAN SMALL BUSINESS,,2009
DAYZIMMERMANNINCKSDIV,0.0,0.0,1.0,50.0,7000000.0,1,DAY AND ZIMMERMANN INCORPORATED,"DAY & ZIMMERMANN, INC -KS DIV",,OTHER THAN SMALL BUSINESS,,2009
DBAMSUPPLYINC,0.0,0.0,2997.0,2.0,5000.0,3,"FEHL, STACY","DBAM SUPPLY, INC.",,SMALL BUSINESS,,2009
DBCONSULTINGGROUPINC,0.0,0.0,10.0,283.75,18150000.0,8,GERALD B BOYD JR DBA DB CONSULTING GROUP,"DB CONSULTING GROUP, INC.",,SMALL BUSINESS,,2009
DCHUMPHRYSCO,0.0,0.0,4.0,70.0,11400000.0,4,"HUMPHRYS, D. C. CO.",D. C. HUMPHRYS CO.,,SMALL BUSINESS,,2009
DCSCORPORATION,0.0,0.0,21.0,0.0,0.0,1,DCS CORPORATION,DCS CORPORATION,,OTHER THAN SMALL BUSINESS,,2009
DCXCHOLENTERPRISESINC,0.0,327599.99,2.0,660.0,70000000.0,1,DCX-CHOL ENTERPRISE INC,DCX-CHOL ENTERPRISES  INC.,CORPORATE NOT TAX EXEMPT,OTHER THAN SMALL BUSINESS,CORPORATE NOT TAX EXEMPT,2009
DDLOMNIENGINEERINGCORP,0.0,0.0,11.0,220.0,33482488.0,6,DDL OMNI ENGINEERING CORP,DDL OMNI ENGINEERING CORP,,SMALL BUSINESS,,2009
DDSERVICESINC,396.0,396.0,1.0,4.0,350000.0,1,D AND D SERVICES INCORPORATED,D & D SERVICES INC,,SMALL BUSINESS,,2009
DEAFEXPRESSIONINC,0.0,0.0,3.0,3.0,700000.0,1,"DEAF EXPRESSION, INC.","DEAF EXPRESSION, INC.",,SMALL BUSINESS,,2009
DEANFOODSCOMPANY,600626.2800000001,600626.2800000001,44.0,3804.285714285714,1263142857.142857,7,"PET O'FALLON, LLC",DEAN FOODS COMPANY,OTHER,OTHER THAN SMALL BUSINESS,OTHER,2009
DECATURCITYSCHOOLDIST,0.0,0.0,30.0,200.0,80000.0,1,DECATUR CITY SCHOOL DIST,DECATUR CITY SCHOOL DIST,,OTHER THAN SMALL BUSINESS,,2009
DECISIONONECORPORATION,0.0,0.0,1.0,2500.0,400000000.0,1,DECISIONONE CORPORATION,DECISIONONE CORPORATION,,OTHER THAN SMALL BUSINESS,,2009
DECISIONSCIENCESINCORPORATED,0.0,0.0,999.0,0.0,0.0,1,DECISION SCIENCES INCORPORATED,DECISION SCIENCES INCORPORATED,,SMALL BUSINESS,,2009
DEFENSECIVILIANMEDICALASSOCIATESLLC,0.0,0.0,1.0,7.0,5330806.0,1,"DEFENSE CIVILIAN MEDICAL ASSOCIATES, LLC","DEFENSE CIVILIAN MEDICAL ASSOCIATES, LLC",,OTHER THAN SMALL BUSINESS,,2009
DEFENSECONTRACTSERVICESINC,136165.32,136165.32,4.0,210.0,6860000.0,1,DEFENSE CONTRACT SERVICES INCORPORATED,DEFENSE CONTRACT SERVICES INC,,SMALL BUSINESS,,2009
DEFENSEGROUPINC,10794.71,10794.71,999.0,137.0,19000000.0,2,DEFENSE GROUP INCORPORATED,DEFENSE GROUP INC.,,SMALL BUSINESS,,2009
DEFENSEHOLDINGSINC,0.0,0.0,2016.0,0.0,0.0,13,"NOESIS, INC",DEFENSE HOLDINGS INC,,SMALL BUSINESS,,2009
DEFENSEINVESTIGATORSGROUPINC,0.0,0.0,999.0,34.0,2200000.0,1,DEFENSE INVESTIGATORS GROUP INC,"DEFENSE INVESTIGATORS GROUP, INC.",,SMALL BUSINESS,,2009
DEFENSESUPPORTSERVICESLLC,50284933.04,111004128.04,12.0,3550.0,1135000000.0,2,DEFENSE SUPPORT SERVICES LIMITED LIABILITY COMPANY,DEFENSE SUPPORT SERVICES LLC,,OTHER THAN SMALL BUSINESS,,2009
DEHGHANSARA,9000.0,9000.0,2.0,1.0,500.0,3,"DEHGHAN, SARA",DEHGHAN  SARA,SOLE PROPRIETORSHIP,SMALL BUSINESS,SOLE PROPRIETORSHIP,2009
DEKKERLTD,0.0,0.0,1.0,50.0,5100000.0,1,"DEKKER, LTD","DEKKER, LTD",,SMALL BUSINESS,,2009
DELAWARESTATEOF,0.0,0.0,1.0,65.0,3000000.0,1,HEALTH AND SOCIAL SERVICES DELAWARE DEPT OF (0380),"DELAWARE, STATE OF",,OTHER THAN SMALL BUSINESS,,2009
DELEHOYCONSTRUCTIONINC,0.0,0.0,9.0,12.0,3469492.0,1,"DELEHOY CONSTRUCTION, INC.","DELEHOY CONSTRUCTION, INC.",,SMALL BUSINESS,,2009
DELEXSYSTEMSINCORPORATED,34933665.46,3034933665.46,58.0,0.0,0.0,4,"DELEX SYSTEMS, INCORPORATED",DELEX SYSTEMS  INCORPORATED,,SMALL BUSINESS,,2009
DELICIASDEMARYTIERRAEXUBERANTCATERING,0.0,0.0,2.0,10.0,1.0,1,DELICIAS DE MAR Y TIERRA & EXUBERANT CATERING,DELICIAS DE MAR Y TIERRA & EXUBERANT CATERING,,SMALL BUSINESS,,2009
DELLFEDERALSYSTEMSLP,0.0,0.0,30.0,68375.0,8125000235.75,8,DELL FEDERAL SYSTEMS LIMITED PARTNERSHIP,DELL FEDERAL SYSTEMS L.P.,,OTHER THAN SMALL BUSINESS,,2009
DELLMARKETINGLP,0.0,0.0,6.0,14166.666666666666,10833333333.333334,6,DELL MARKETING LIMITED PARTNERSHIP,DELL MARKETING L.P.,,OTHER THAN SMALL BUSINESS,,2009
DELLSERVICESFEDERALGOVERNMENTINC,0.0,0.0,16.0,22000.0,3000000000.0,20,PEROT SYSTEMS GOVERNMENT SERVICES INCORPORATED (8756),DELL SERVICES FEDERAL GOVERNMENT  INC.,,OTHER THAN SMALL BUSINESS,,2009
DELOITTELLP,2603453347.34,2603453347.34,1031.0,3612.8947368421054,939210544.2105263,19,DELOITTE CONSULTING LLP,DELOITTE LLP,,OTHER THAN SMALL BUSINESS,,2009
DELREYSYSTEMSANDTECHNOLOGYINC,49994.01,49994.01,1.0,0.0,0.0,1,"DEL REY SYSTEMS & TECHNOLOGY,",DEL REY SYSTEMS AND TECHNOLOGY  INC.,,SMALL BUSINESS,,2009
DELSIRSUPPLYINC,0.0,0.0,2.0,9.0,1650000.0,1,"DEL-SIR SUPPLY, INC","DEL-SIR SUPPLY, INC",,SMALL BUSINESS,,2009
DELTAMICROWAVEINC,28728.0,28728.0,2.0,42.5,9500000.0,2,DELTA MICROWAVE INCORPORATED,DELTA MICROWAVE  INC.,,SMALL BUSINESS,,2009
DELTARESOURCESINC,47219512.06,52444870.08,7.0,70.0,5000000.0,2,"DELTA RESOURCES, INC.",DELTA RESOURCES  INC.,,OTHER THAN SMALL BUSINESS,,2009
DEMBOJONESHEALYPENNINGTONMARSHALLPC,0.0,0.0,14.0,40.0,2000000.0,2,"DEMBO, JONES, HEALY, PENNINGTO",DEMBO JONES HEALY PENNINGTON & MARSHALL PC,,SMALL BUSINESS,,2009
DENALIHOLDINGINC,570408822.3000001,4269896267.000001,86.0,13395.454545454546,3772727273.8939395,66,DELL FEDERAL SYSTEMS LIMITED PARTNERSHIP,DENALI HOLDING INC,,OTHER THAN SMALL BUSINESS,,2009
DENARDIMACHINERYINC,4647.23,4647.23,0.0,16.0,9000000.0,1,"DENARDI MACHINERY,INC",DENARDI MACHINERY  INC.,,SMALL BUSINESS,,2009
DENISEGARZA,0.0,0.0,1.0,1.0,28000.0,1,DENISE GARZA,DENISE GARZA,,SMALL BUSINESS,,2009
DENTSPLYINTERNATIONALINC,0.0,0.0,5.0,1666.6666666666667,60000000.0,3,DENTSPLY INTERNATIONAL INC.,DENTSPLY INTERNATIONAL INC.,,OTHER THAN SMALL BUSINESS,,2009
DENVERHEALTHANDHOSPITALSAUTHORITY,0.0,0.0,49.0,3540.0,421480000.0,3,DENVER HEALTH AND HOSPITALS AUTHORITY INCORPORATED,DENVER HEALTH AND HOSPITALS AUTHORITY,,OTHER THAN SMALL BUSINESS,,2009
DEPARTMENTOFOFFSTREETPARKINGOFTHECITYOFMIAMI,0.0,0.0,2.0,110.0,17000000.0,2,DEPARTMENT OF OFF STREET PARKING OF THE CITY OF MIAMI,DEPARTMENT OF OFF STREET PARKING OF THE CITY OF MIAMI,,OTHER THAN SMALL BUSINESS,,2009
DEPAULINDUSTRIES,373282.49,373282.49,1.0,1227.0,16196559.0,1,DEPAUL INDUSTRIES,DEPAUL INDUSTRIES,CORPORATE TAX EXEMPT,OTHER THAN SMALL BUSINESS,CORPORATE TAX EXEMPT,2009
DEREKRHENKLECOMMUNICATIONS,8265.0,8265.0,1.0,1.0,1.0,2,DEREK R HENKLE COMMUNICATIONS,DEREK R HENKLE COMMUNICATIONS,SOLE PROPRIETORSHIP,SMALL BUSINESS,SOLE PROPRIETORSHIP,2009
DESAINC,202076.28,202076.28,1.0,22.0,2015110.0,1,"DESA, INC.",DESA  INC.,CORPORATE NOT TAX EXEMPT,SMALL BUSINESS,CORPORATE NOT TAX EXEMPT,2009
DESCARGADEPORTIVA,0.0,0.0,3.0,2.0,150000.0,1,DESCARGA DEPORTIVA,DESCARGA DEPORTIVA,CORPORATE NOT TAX EXEMPT,SMALL BUSINESS,CORPORATE NOT TAX EXEMPT,2009
DESERTBUSINESSMACHINESINC,1500.0,1500.0,1.0,0.0,0.0,1,"DESERT BUSINESS MACHINES, INC",DESERT BUSINESS MACHINES  INC.,,SMALL BUSINESS,,2009
DESERTIMAGESOFFICEEQUIPMENTINC,149595.0,195261.0,11.0,4.0,10000.0,2,JOHN P ZACCARIA,DESERT IMAGES OFFICE EQUIPMENT  INC.,,SMALL BUSINESS,,2009
DESERTOFFICESOLUTIONS,17550.0,17550.0,1.0,0.0,0.0,1,"DESERT OFFICE SOLUTIONS, LLC",DESERT OFFICE SOLUTIONS,,SMALL BUSINESS,,2009
DESIGNASSISTANCECORPORATION,0.0,0.0,1.0,15.0,1200000.0,1,DESIGN ASSISTANCE CORPORATION,DESIGN ASSISTANCE CORPORATION,,SMALL BUSINESS,,2009
DESIGNASSOCIATESINTERNATIONALINC,9301.2,9301.2,9995.0,11.0,1000000.0,12,DESIGN ASSOCIATES INTERNATIONAL INCORPORATED,DESIGN ASSOCIATES INTERNATIONAL INC,,SMALL BUSINESS,,2009
DESIGNTEAMONEINCORPORATED,0.0,0.0,0.0,2.0,86225.0,1,DESIGN TEAM ONE INCORPORATED,DESIGN TEAM ONE INCORPORATED,,SMALL BUSINESS,,2009
DESIGNWESTTECHNOLOGIESINC,501600.0,501600.0,3.0,30.0,3000000.0,1,DESIGN WEST TECHNOLOGIES INCORPORATED,DESIGN WEST TECHNOLOGIES  INC.,,SMALL BUSINESS,,2009
DESMOINESUNVIERSITYOSTEOPATHICMEDICALCENTER,0.0,0.0,1.0,0.0,0.0,1,DES MOINES UNVIERSITY OSTEOPATHIC MEDICAL CENTER,DES MOINES UNVIERSITY OSTEOPATHIC MEDICAL CENTER,,OTHER THAN SMALL BUSINESS,,2009
DESTINYALLIANCECONSULTINGLLC,4751.43,4751.43,6.0,1.0,1.0,1,"DESTINY ALLIANCE CONSULTING, LLC",DESTINY ALLIANCE CONSULTING  LLC,CORPORATE NOT TAX EXEMPT,SMALL BUSINESS,CORPORATE NOT TAX EXEMPT,2009
DESTINYMANAGEMENTSERVICESLLC,3372037.0,3556438.0,20.0,10.0,690000.0,11,DESTINY MANAGEMENT SERVICES LL,DESTINY MANAGEMENT SERVICES LLC,,SMALL BUSINESS,,2009
DETYENSSHIPYARDSINC,8025168.0,8025168.0,2.0,650.0,55000000.0,1,"DETYENS SHIPYARDS, INC",DETYENS SHIPYARDS  INC.,,SMALL BUSINESS,,2009
DEVAASSOCIATESPC,0.0,0.0,0.0,40.0,2300000.0,2,"DEVA & ASSOCIATES, P.C.",DEVA & ASSOCIATES PC,,SMALL BUSINESS,,2009
DEVCICDAVOR,24990.0,24990.0,3.0,1.0,1.0,3,"DEVCIC, DAVOR",DEVCIC  DAVOR,SOLE PROPRIETORSHIP,OTHER THAN SMALL BUSINESS,SOLE PROPRIETORSHIP,2009
DEVELOPMENTALTERNATIVESINC,334197997.85,383150168.26,17.0,946.6666666666666,116683333.33333333,6,"DEVELOPMENT ALTERNATIVES, INC.",DEVELOPMENT ALTERNATIVES  INC.,,OTHER THAN SMALL BUSINESS,,2009
DEVINECONSULTINGINC,31228.0,31228.0,2.0,35.0,4100000.0,2,"DEVINE CONSULTING, INC.",DEVINE CONSULTING  INC.,OTHER,OTHER THAN SMALL BUSINESS,OTHER,2009
DEVTECHSYSTEMSINC,0.0,0.0,5.0,0.0,0.0,1,"DEVTECH SYSTEMS, INC","DEVTECH SYSTEMS, INC.",,SMALL BUSINESS,,2009
DEWCONSTRUCTIONCORP,2252469.26,2252469.26,12.0,120.0,65000000.0,2,DEW CONSTRUCTION CORPORATION,D.E.W. CONSTRUCTION CORP.,,OTHER THAN SMALL BUSINESS,,2009
DFFRAIREINC,1511693.56,1511693.56,2.0,18.0,500000.0,2,"D&F FRAIRE, INC.",D&F FRAIRE  INC.,CORPORATE NOT TAX EXEMPT,SMALL BUSINESS,CORPORATE NOT TAX EXEMPT,2009
DGM21LLC,0.0,0.0,2.0,50.0,10000000.0,2,DGM21 LIMITED LIABILITY COMPANY,"DGM21, LLC",,OTHER THAN SMALL BUSINESS,,2009
DHMCHICAGOHOTELLP,48974.86,22811.07,0.0,140.0,18000000.0,2,"DHM CHICAGO HOTEL, L.P.","DHM CHICAGO HOTEL, L.P.",PARTNERSHIP,OTHER THAN SMALL BUSINESS,PARTNERSHIP,2009
DHSTECHNOLOGIESLLC,675314.73,675314.73,2.0,0.0,0.0,1,DHS SYSTEMS LLC,DHS TECHNOLOGIES LLC,,SMALL BUSINESS,,2009
DIABETICSOLUTIONSCORP,0.0,0.0,0.0,8.0,5.0,1,DIABETIC SOLUTIONS MEDICAL EQUIPMENT,DIABETIC SOLUTIONS CORP.,,OTHER THAN SMALL BUSINESS,,2009
DIAGNOSTICASTAGOINC,0.0,0.0,52.0,250.0,12000000.0,43,DIAGNOSTICA STAGO INC.,DIAGNOSTICA STAGO INC.,,OTHER THAN SMALL BUSINESS,,2009
DIAGNOSYSSYSTEMSINC,0.0,0.0,2.0,0.0,0.0,2,DIAGNOSYS SYSTEMS INC,DIAGNOSYS SYSTEMS INC.,,SMALL BUSINESS,,2009
DIAMONDCHEMICALCOINC,0.0,0.0,3000.0,220.0,30133504.0,4,DIAMOND CHEMICAL CO INC,DIAMOND CHEMICAL CO INC,,SMALL BUSINESS,,2009
DIAMONDDGENERALENGINEERINGINC,2812423.0,2812423.0,1.0,24.0,3500000.0,1,"DIAMOND D GENERAL ENGINEERING, INC.",DIAMOND D GENERAL ENGINEERING  INC.,CORPORATE NOT TAX EXEMPT,SMALL BUSINESS,CORPORATE NOT TAX EXEMPT,2009
DIAMONDHEADSEAFOODWHOLESALEINC,265321.9,265321.9,7.0,45.0,3000000.0,1,DIAMOND HEAD SEAFOOD WHOLESALE INCORPORATED,DIAMOND HEAD SEAFOOD WHOLESALE INC.,,SMALL BUSINESS,,2009
DIAMONDHILLSSERVICESINC,5235.89,5235.89,1.0,35.0,3000000.0,1,"DIAMOND HILLS SERVICES, INC.",DIAMOND HILLS SERVICES  INC.,CORPORATE NOT TAX EXEMPT,SMALL BUSINESS,CORPORATE NOT TAX EXEMPT,2009
DIBABAHMANA,1350.0,1350.0,1.0,1.0,3.0,2,"DIBA, BAHMAN A",DIBA  BAHMAN A,SOLE PROPRIETORSHIP,SMALL BUSINESS,SOLE PROPRIETORSHIP,2009
DIESELENGINETECHNICIAN,0.0,0.0,6.0,7.0,2.0,2,DIESEL ENGINE TECHNICIAN,DIESEL ENGINE TECHNICIAN,,SMALL BUSINESS,,2009
DIETARYEQUIPMENTINCORPORATED,43105.66,43105.66,8.0,10.0,11333333.333333334,3,DIETARY EQUIPMENT INCORPORATED,DIETARY EQUIPMENT INCORPORATED,,SMALL BUSINESS,,2009
DIGICONCORPORATION,16608316.87,17996255.05,1.0,317.0,60000000.0,1,DIGICON CORPORATION,DIGICON CORPORATION,,OTHER THAN SMALL BUSINESS,,2009
DIGITALLIFELLC,22790.0,22790.0,0.0,1.0,1.0,4,"DIGITAL LIFE, LLC",DIGITAL LIFE  LLC,PARTNERSHIP,OTHER THAN SMALL BUSINESS,PARTNERSHIP,2009
DIGITALMANAGEMENTINC,0.0,0.0,3.0,53.0,5280000.0,1,DIGITAL MANAGEMENT INC,"DIGITAL MANAGEMENT, INC.",,SMALL BUSINESS,,2009
DIGITALSYSTEMSGROUPINC,0.0,0.0,1.0,0.0,0.0,1,"DIGITAL SYSTEMS GROUP, INC","DIGITAL SYSTEMS GROUP, INC",,SMALL BUSINESS,,2009
DIKMENEDA,158420.0,158420.0,2.0,1.0,40000.0,2,"DIKMEN, EDA",DIKMEN  EDA,SOLE PROPRIETORSHIP,SMALL BUSINESS,SOLE PROPRIETORSHIP,2009
DILLONAEROINC,0.0,0.0,4.0,32.0,10000000.0,4,"DILLON AERO, INC.","DILLON AERO, INC.",,SMALL BUSINESS,,2009
DIONISIOLCORPUZ,0.0,0.0,3.0,6.0,400000.0,1,DIONISIO L CORPUZ,DIONISIO L CORPUZ,,SMALL BUSINESS,,2009
DIPLOMATFREIGHTSERVICESINC,0.0,0.0,8.0,45.0,50000000.0,1,DIPLOMAT FREIGHT SERVICE INC,"DIPLOMAT FREIGHT SERVICES, INC.",,OTHER THAN SMALL BUSINESS,,2009
DIRECTRESOURCEINC,0.0,0.0,1.0,12.0,10335000.0,1,"DIRECT RESOURCE, INC.","DIRECT RESOURCE, INC.",,SMALL BUSINESS,,2009
DIRECTV,4062.48,6770.8,1.0,11300.0,14000000000.0,1,"DIRECTV, INC.",DIRECTV,CORPORATE NOT TAX EXEMPT,OTHER THAN SMALL BUSINESS,CORPORATE NOT TAX EXEMPT,2009
DISCMARKETINGLLC,0.0,965690.0,1.0,100.0,5000000.0,1,DISC MARKETING LIMITED LIABILITY COMPANY,DISC MARKETING  LLC,,OTHER THAN SMALL BUSINESS,,2009
DITOMASOINCORPORATED,594703.9099999999,594703.9099999999,9.0,45.0,20000000.0,2,DI TOMASO INCORPORATED,DI TOMASO INCORPORATED,,SMALL BUSINESS,,2009
DIVERSEPRODUCTSINC,26120.23,26120.23,3.0,5.0,2500000.0,1,"DIVERSE PRODUCTS, INC",DIVERSE PRODUCTS  INC,CORPORATE NOT TAX EXEMPT,SMALL BUSINESS,CORPORATE NOT TAX EXEMPT,2009
DIVERSIFIEDCOLLECTIONSERVICESINC,0.0,0.0,40.0,610.0,21800000.0,1,DIVERSIFIED COLLECTION SERVICE,"DIVERSIFIED COLLECTION SERVICES, INC",,OTHER THAN SMALL BUSINESS,,2009
DIVERSIFIEDCONSULTINGENGINEERS,0.0,0.0,0.0,2.0,200000.0,1,DIVERSIFIED CONSULTING ENGINEERS,DIVERSIFIED CONSULTING ENGINEERS,,OTHER THAN SMALL BUSINESS,,2009
DIVERSIFIEDMACHININGINC,0.0,0.0,1.0,44.0,3000000.0,1,"DIVERSIFIED MACHINING, INC.","DIVERSIFIED MACHINING, INC.",,SMALL BUSINESS,,2009
DIVERSIFIEDMETALFABRICATORSINC,3356.1,3356.1,3.0,13.0,2.0,1,"DIVERSIFIED METAL FABRICATORS, INC",DIVERSIFIED METAL FABRICATORS  INC,,SMALL BUSINESS,,2009
DIVITAENTERPRISESINC,24256.0,24256.0,4.0,50.0,2400000.0,1,DIVITA ENTERPRISES INCORPORATED,DIVITA ENTERPRISES INC,,SMALL BUSINESS,,2009
DIXIEMURDOCK,0.0,0.0,0.0,1.0,5000.0,1,DIXIE MURDOCK,DIXIE MURDOCK,,SMALL BUSINESS,,2009
DKENTERPRISEINC,0.0,0.0,0.0,30.0,8579166.0,1,"DK ENTERPRISE, INC.",DK ENTERPRISE  INC.,CORPORATE NOT TAX EXEMPT,SMALL BUSINESS,CORPORATE NOT TAX EXEMPT,2009
DLANAFINEWCUMBERLANDPA,0.0,0.0,3.0,23.0,450000.0,1,DLA NAFI NEW CUMBERLAND PA,DLA NAFI NEW CUMBERLAND PA,,OTHER THAN SMALL BUSINESS,,2009
DLNHOLDINGSLLC,41679.2,41679.2,1.0,350.0,78000000.0,1,DATALINE INCORPORATED,DLN HOLDINGS LLC,,SMALL BUSINESS,,2009
DLSENGINEERINGASSOCIATESINC,3885974.74,3885974.74,2.0,130.0,6500000.0,2,DLS ENGINEERING ASSOCIATES INCORPORATED,DLS ENGINEERING ASSOCIATES  INC.,,SMALL BUSINESS,,2009
DLTSOLUTIONSLLC,552490.64,552490.64,265.0,176.08163265306123,389183558.0102041,196,"DLT SOLUTIONS, INC.","DLT SOLUTIONS, LLC",,OTHER THAN SMALL BUSINESS,,2009
DMARKCORPORATION,7551.42,7551.42,0.0,6.0,2000000.0,1,D-MARK CORPORATION,D-MARK CORPORATION,,SMALL BUSINESS,,2009
DMAUTOPARTSCORP,0.0,0.0,1.0,8.0,250000.0,1,D & M AUTO PARTS CORP,D & M AUTO PARTS CORP,,OTHER THAN SMALL BUSINESS,,2009
DMCMANAGEMENTSERVICESLLC,0.0,0.0,999.0,2.0,9000000.0,1,"DMC MANAGEMENT SERVICES, LLC","DMC MANAGEMENT SERVICES, LLC",,OTHER THAN SMALL BUSINESS,,2009
DMDGROUPINC,7346257.94,7346257.94,54.0,977.0,225541664.0,18,"DMD, L.L.C.","DMD GROUP, INC.",,SMALL BUSINESS,,2009
DMSPHARMACEUTICALGROUPINC,836255.0,836255.0,253.0,13.525773195876289,25360824.74226804,97,DMS PHARMACEUTICAL GROUP INC.,DMS PHARMACEUTICAL GROUP INC.,,SMALL BUSINESS,,2009
DNASOFTWAREINC,0.0,0.0,44.0,10.0,1000000.0,1,DNA SOFTWARE INCORPORATED,DNA SOFTWARE INC,,SMALL BUSINESS,,2009
DOCUMENTANDPACKAGINGBROKERSINC,0.0,0.0,3.0,0.0,0.0,1,DOCUMENT AND PACKAGING BROKERS,"DOCUMENT AND PACKAGING BROKERS, INC.",,SMALL BUSINESS,,2009
DOCUMENTCONVERSIONASSOCIATESINC,0.0,0.0,2.0,13.0,5000000.0,1,DOCUMENT CONVERSION ASSOCIATES INCORPORATED,DOCUMENT CONVERSION ASSOCIATES INC.,,SMALL BUSINESS,,2009
DOCUMENTIMAGINGDIMENSIONSINC,102764.74999999997,103077.98999999998,7008.0,8.0,930000.0,13,DOCUMENT IMAGING DIMENSIONS,DOCUMENT IMAGING DIMENSIONS INC.,,SMALL BUSINESS,,2009
DODGEMOVINGSTORAGECOINC,8279.5,8279.5,3.0,49.0,9581772.0,1,"DODGE MOVING & STORAGE CO., INC.",DODGE MOVING & STORAGE CO INC,CORPORATE NOT TAX EXEMPT,SMALL BUSINESS,CORPORATE NOT TAX EXEMPT,2009
DOLLARTHRIFTYAUTOMOTIVEGROUPINC,4728.6,4728.6,4.0,4625.0,157000000.0,2,"DOLLAR THRIFTY AUTOMOTIVE GROUP, INC.",DOLLAR THRIFTY AUTOMOTIVE GROUP  INC.,,OTHER THAN SMALL BUSINESS,,2009
DOLORESTAIJERON,0.0,0.0,1.0,1.0,187500.0,1,DOLORES TAIJERON,DOLORES TAIJERON,,SMALL BUSINESS,,2009
DOLPHINTECHNOLOGYINCORPORATED,0.0,0.0,12.0,0.0,0.0,6,DOLPHIN TECHNOLOGY INC,DOLPHIN TECHNOLOGY INCORPORATED,,SMALL BUSINESS,,2009
DOMESTICAWARDEESUNDISCLOSED,0.0,0.0,12.0,5008.0,20000800.0,10,DOMESTIC CONTRACTOR (UNDISCLOSED),DOMESTIC AWARDEES (UNDISCLOSED),,SMALL BUSINESS,,2009
DOMESTICCONTRACTORUNDISCLOSED,12244572.86,14921276.120000001,7.0,3.5714285714285716,286.42857142857144,21,DOMESTIC CONTRACTOR (UNDISCLOSED),DOMESTIC CONTRACTOR (UNDISCLOSED),OTHER,OTHER THAN SMALL BUSINESS,OTHER,2009
DOMINIONRESOURCESINC,287704658.6,287704658.6,1.0,15266.555555555555,2256888947.6666665,9,VIRGINIA ELECTRIC AND POWER COMPANY,DOMINION RESOURCES  INC.,CORPORATE NOT TAX EXEMPT,OTHER THAN SMALL BUSINESS,CORPORATE NOT TAX EXEMPT,2009
DONARSKIJRCONRADJOSEPH,230618.8,230618.8,1.0,1.0,45700.0,1,"DONARSKI JR, CONRAD JOSEPH",DONARSKI JR  CONRAD JOSEPH,,SMALL BUSINESS,,2009
DONDISOUND,19003.0,19003.0,2.0,1.0,32930.0,1,DONDI SOUND,DONDI SOUND,,SMALL BUSINESS,,2009
DONGXIAOMEI,10800.0,10800.0,1.0,1.0,43000.0,1,"DONG, XIAOMEI",DONG  XIAOMEI,SOLE PROPRIETORSHIP,SMALL BUSINESS,SOLE PROPRIETORSHIP,2009
DOOLEYTHOMASJ,0.0,0.0,0.0,1.0,42000.0,1,"DOOLEY, THOMAS J","DOOLEY, THOMAS J",SOLE PROPRIETORSHIP,OTHER THAN SMALL BUSINESS,SOLE PROPRIETORSHIP,2009
DOOSANINTERNATIONALUSAINC,675249.03,675249.03,1.0,4500.0,14800000000.0,1,"DOOSAN INTERNATIONAL USA, INC","DOOSAN INTERNATIONAL USA, INC",CORPORATE NOT TAX EXEMPT,OTHER THAN SMALL BUSINESS,CORPORATE NOT TAX EXEMPT,2009
DORMAHOLDINGGMBHCOKGAUFAKTIEN,0.0,0.0,3.0,200.0,50000000.0,1,CAROLINA DOOR CONTROLS INCORPORATED (5325),DORMA HOLDING GMBH & CO. KG AUF AKTIEN,,OTHER THAN SMALL BUSINESS,,2009
DOROTHYPEPPERSPOWELL,0.0,0.0,0.0,1.0,6500.0,2,DOROTHY PEPPERS-POWELL,DOROTHY PEPPERS-POWELL,,SMALL BUSINESS,,2009
DOUBLEEAGLESTRATEGIESLLC,0.0,0.0,999.0,85.0,15000000.0,1,"RWC CONSULTING GROUP, LLC",DOUBLE EAGLE STRATEGIES  LLC,,OTHER THAN SMALL BUSINESS,,2009
DOUBLEHPRODUCTIONSCORPINC,0.0,0.0,1.0,1.0,125000.0,1,DOUBLE H PRODUCTION INC,DOUBLE-H-PRODUCTIONS CORP. INC,,SMALL BUSINESS,,2009
DOVEENVIRONMENTALMANAGEMENT,132744.0,132744.0,3.0,2.0,150000.0,1,DOVE ENVIRONMENTAL MANAGEMENT,DOVE ENVIRONMENTAL MANAGEMENT,SOLE PROPRIETORSHIP,SMALL BUSINESS,SOLE PROPRIETORSHIP,2009
DOVERCORPORATION,0.0,0.0,10.0,33400.0,6230065136.8,10,"KALYN/SIEBERT I, INCORPORATED",DOVER CORPORATION,,OTHER THAN SMALL BUSINESS,,2009
DOWLINGTEXTILECOMPANY,0.0,0.0,1.0,800.0,125000000.0,1,ENCOMPASS GROUP LIMITED LIABILITY COMPANY (1437),DOWLING TEXTILE COMPANY,,SMALL BUSINESS,,2009
DOYONLIMITED,88786.0,88786.0,1.0,40.0,5900000.0,1,EMERALD CONSULTING GROUP LLC,DOYON  LIMITED,CORPORATE NOT TAX EXEMPT,SMALL BUSINESS,CORPORATE NOT TAX EXEMPT,2009
DOZERINC,0.0,0.0,1.0,0.0,6927300.0,1,"DOZER, INC","DOZER, INC",,SMALL BUSINESS,,2009
DPRAINCORPORATED,0.0,0.0,16.0,192.85714285714286,24285714.285714287,7,DPRA INCORPORATED,DPRA INCORPORATED,,SMALL BUSINESS,,2009
DPSINC,1195630.3,1195630.3,37.0,70.66666666666667,4133333.3333333335,3,"DPS, INC",DPS  INC.,,SMALL BUSINESS,,2009
DPTECHNOLOGYSERVICESINC,2027414.75,2027414.75,8.0,27.0,1400000.0,3,D P TECHNOLOGY SERVICES INCORPORATED,DP TECHNOLOGY SERVICES  INC.,,SMALL BUSINESS,,2009
DQSICORPORATION,3905272.79,3905272.79,3.0,18.0,1500000.0,1,DQSI CORPORATION,DQSI  CORPORATION,,SMALL BUSINESS,,2009
DRACRTCHAMBLEECENTERLLC,0.0,0.0,3.0,10.0,18861176.333333332,3,DRA CRT CHAMBLEE CENTER LLC,DRA CRT CHAMBLEE CENTER LLC,,OTHER THAN SMALL BUSINESS,,2009
